link,title,post_day,street,old_address,locality,region,listing_id,direction,listing_type,property_type,legal_status,num_floors,num_bedrooms,road_width_m,width_m,length_m,price_vnd,area_m2,dining_room_bin,kitchen_bin,terrace_bin,car_parking_bin,owner_listing_bin,locality_square,locality_population_density,lat,lon,matched_address,distance_to_center_km,nearest_school_km,school_count_3km,nearest_hospital_km,hospital_count_5km,nearest_marketplace_km,marketplace_count_3km,nearest_supermarket_km,supermarket_count_3km,nearest_mall_km,mall_count_3km,nearest_bus_stop_km,bus_stop_count_1km,nearest_metro_km,metro_count_5km
https://alonhadat.com.vn/sap-san-chi-175tr-m2-re-nhat-mat-tien-ung-van-khiem-p25-binh-thanh-9x35m-xd-h-7lau-47ty-18173187.html,Sập sàn chỉ 175tr/m2 rẻ nhất mặt tiền Ung Văn Khiêm P25 Bình Thạnh - 9x35m XD H+ 7lầu_47tỷ,2026-06-10,đường ung văn khiêm,"Đường Ung Văn Khiêm, Phường 25, Quận Bình Thạnh, Hồ Chí Minh (cũ)",phường thạnh mỹ tây,hồ chí minh,18173187,unknown,can_ban,nha_mat_tien,unknown,7.0,7.0,10.0,9.0,35.0,47000000000.0,288.0,0,0,0,0,0,"4,40",34.822,10.8029912,106.7231035,"đường ung văn khiêm, phường thạnh mỹ tây, hồ chí minh, Vietnam",3.77169218113364,0.5231225231110117,67.0,1.2758244586100067,27.0,0.2811217244834689,12.0,0.2030106907357061,36.0,1.1180942600322077,6.0,0.1553214320715076,31.0,0.4872894791132643,9.0
https://alonhadat.com.vn/ngop-bank-33-ty-ngay-thu-nhap-1-8ty-nam-toa-nha-chdv-xo-viet-nghe-tinh-h-5-tang-9x30m--18173174.html,Ngộp bank! 33 tỷ ngay thu nhập 1.8tỷ/năm tòa nhà CHDV Xô Viết Nghệ Tĩnh H 5 tầng_(9x30m),2026-06-10,đường xô viết nghệ tĩnh,"Đường Xô Viết Nghệ Tĩnh, Phường 26, Quận Bình Thạnh, Hồ Chí Minh (cũ)",phường bình thạnh,hồ chí minh,18173174,unknown,can_ban,nha_mat_tien,unknown,5.0,5.0,30.0,9.0,30.0,33000000000.0,270.0,0,0,0,0,0,"3,32",38.042,10.8151749,106.7153925,"đường xô viết nghệ tĩnh, phường bình thạnh, hồ chí minh, Vietnam",4.520653404846328,0.1320600462100931,62.0,2.179595633175327,21.0,1.4025050685605098,11.0,0.5202736162774874,39.0,1.537111823153571,3.0,0.3125202021852784,27.0,2.025492091474758,8.0
https://alonhadat.com.vn/vi-tri-doc-ton-goc-2-mt-nguyen-huu-cau-tran-quang-khai-q1-13x17m-5-tang-hdt-330tr-85-ty-18173153.html,Vị trí độc tôn! Góc 2 MT Nguyễn Hữu Cầu_Trần Quang Khải Q1_13x17m_5 tầng_HĐT 330tr_85 tỷ,2026-06-10,đường nguyễn hữu cầu,"Đường Nguyễn Hữu Cầu, Phường Tân Định, Quận 1, Hồ Chí Minh (cũ)",phường tân định,hồ chí minh,18173153,unknown,can_ban,nha_mat_tien,unknown,5.0,5.0,221.0,13.0,17.0,85000000000.0,221.0,0,0,0,0,0,"1,23",39.45,10.8664481,106.6142763,"đường nguyễn hữu cầu, hồ chí minh, Vietnam",13.70555991823766,0.0724270104920291,28.0,1.901497541428416,5.0,0.4233336413173288,13.0,0.8194699132210612,5.0,5.0,0.0,0.0611272419040739,23.0,5.0,0.0
https://alonhadat.com.vn/tin-that-100-toa-nha-chdv-7-tang-mt-le-quang-dinh-p14-bt-8x40m-hdt-270tr-sieu-re-73-ty-18173135.html,Tin thật 100%! Tòa nhà CHDV 7 tầng MT Lê Quang Định P14 BT_8x40m-HĐT 270tr_ siêu rẻ 73 tỷ,2026-06-10,đường lê quang định,"Đường Lê Quang Định, Phường 14, Quận Bình Thạnh, Hồ Chí Minh (cũ)",phường bình thạnh,hồ chí minh,18173135,unknown,can_ban,nha_mat_tien,unknown,7.0,7.0,30.0,8.0,40.0,73000000000.0,309.0,0,0,0,0,0,"3,32",38.042,10.8045369,106.6985299,"đường lê quang định, phường bình thạnh, hồ chí minh, Vietnam",3.067975386545508,0.1536564277820822,117.0,0.3253671289426457,47.0,0.3173412790612379,16.0,0.127429078630904,61.0,3.0678526059733926,0.0,0.1082694455382833,47.0,2.0800873263501067,7.0
https://alonhadat.com.vn/ket-tien-ban-gap-toa-nha-ham-6lau-mt-le-van-viet-doan-vip-q9-12x-35m-350m2-ve-59-ty-18173116.html,Kẹt tiền bán gấp Tòa nhà Hầm 6Lầu MT Lê Văn Việt đoạn vip Q9- 12x 35m- 350m2_ về 59 tỷ,2026-06-10,đường lê văn việt,"Đường Lê Văn Việt, Phường Tân Phú, Thành phố Thủ Đức, Hồ Chí Minh (cũ)",phường tăng nhơn phú,hồ chí minh,18173116,unknown,can_ban,nha_mat_tien,unknown,6.0,6.0,30.0,12.0,35.0,59000000000.0,350.0,0,0,0,0,0,"16,51",12.613,10.84645,106.7964675,"đường lê văn việt, phường tăng nhơn phú, hồ chí minh, Vietnam",12.9771433605154,0.5410511025652699,27.0,0.7030486939805043,9.0,0.9569606266467954,4.0,1.5278247879223503,5.0,0.4023720886812372,1.0,0.0677421836539363,26.0,1.6186614407756557,5.0
https://alonhadat.com.vn/ban-nha-mt-huynh-tan-phat-ngay-kcx-tan-thuan-dt-8x37m-ctxd-h-8tang-61-ty-18173060.html,Bán Nhà MT Huỳnh Tấn Phát Ngay KCX Tân Thuận.DT:8x37m _CTXD H+8Tầng_61 Tỷ,2026-06-10,đường huỳnh tấn phát,"Đường Huỳnh Tấn Phát, Phường Tân Thuận Đông, Quận 7, Hồ Chí Minh (cũ)",phường tân thuận,hồ chí minh,18173060,unknown,can_ban,nha_mat_tien,unknown,7.0,7.0,30.0,8.0,37.0,61000000000.0,251.0,0,0,0,0,0,"10,16",14.576,10.740907,106.7273649,"đường huỳnh tấn phát, phường tân thuận, hồ chí minh, Vietnam",4.922342575438582,0.2260277069460414,57.0,0.3634630643423928,22.0,1.0658917976558917,8.0,0.4323392280312428,19.0,0.6552665344946447,3.0,0.2882724029361765,25.0,4.630394533575136,3.0
https://alonhadat.com.vn/-no-bank-chi-350-trieu-m2-mt-tran-hung-dao-5x25m-no-hau-6m-cn-150m2-4l-chi-53-ty-18727273.html,🔥Nợ Bank - Chỉ 350 Triệu/m2 MT Trần Hưng Đạo 5x25m Nở Hậu 6m CN 150m2 4L Chỉ 53 Tỷ,2026-06-10,đường trần hưng đạo,"Đường Trần Hưng Đạo, Phường Nguyễn Cư Trinh, Quận 1, Hồ Chí Minh (cũ)",phường cầu ông lãnh,hồ chí minh,18727273,dong_nam,can_ban,nha_mat_tien,so_hong_so_do,4.0,4.0,25.0,6.0,25.0,55000000000.0,155.0,0,0,0,0,0,"1,60",49.209,10.7586762,106.6871256,"đường trần hưng đạo, phường cầu ông lãnh, hồ chí minh, Vietnam",2.5165574682638794,0.2382065710618411,175.0,0.2720899200508758,85.0,0.3475292585322981,43.0,0.4376213933605064,91.0,0.8076369151653383,20.0,0.1129257955810679,70.0,1.7964196622512754,3.0
https://alonhadat.com.vn/ban-can-goc-2-mat-tien-huynh-khuong-ninh-quan-1-dt-5-75x17m-hdt-90tr-thang-chi-39-5-ty-18173048.html,Bán Căn Góc 2 Mặt Tiền Huỳnh Khương Ninh_Quận 1 DT : 5.75x17m HĐT 90Tr/tháng_ Chỉ 39.5 tỷ,2026-06-10,đường huỳnh khương ninh,"Đường Huỳnh Khương Ninh, Phường Đa Kao, Quận 1, Hồ Chí Minh (cũ)",phường tân định,hồ chí minh,18173048,unknown,can_ban,nha_mat_tien,unknown,5.0,5.0,30.0,5.75,17.0,39500000000.0,88.0,0,0,0,0,0,"1,23",39.45,10.790563,106.6944598,"phường tân định, hồ chí minh, Vietnam",1.6673775677301983,0.1549567259302286,143.0,0.3741840666967297,71.0,0.3125277332072336,26.0,0.2351773259655728,106.0,1.4649799392681575,13.0,0.1158050787162368,56.0,1.8016578982038225,6.0
https://alonhadat.com.vn/-cuc-hiem-mt-nguyen-du-q-1-dt-400m-hd-thue-22-000-usd-thang-gia-450-ty-tl-17259235.html,"🔥 Cực Tốt MT Nguyễn Du, Q.1 – DT 20x40m CN 800m2 4 Lầu HĐ 26.000 USD Giá Chỉ 560 tỷ",2026-06-10,đường nguyễn du,"Đường Nguyễn Du, Phường Bến Thành, Quận 1, Hồ Chí Minh (cũ)",phường bến thành,hồ chí minh,17259235,dong_nam,can_ban,nha_mat_tien,so_hong_so_do,4.0,4.0,20.0,20.0,40.0,560000000000.0,800.0,0,0,0,0,0,"1,85",38.809,10.8263083,106.6864244,"đường nguyễn du, hồ chí minh, Vietnam",5.689869923386744,0.1467897825407747,67.0,0.26596737312483,25.0,0.322072903797288,9.0,0.3164850601263114,19.0,0.6814858571754252,7.0,0.1732331170060355,50.0,4.616541993811553,1.0
https://alonhadat.com.vn/can-ban-toa-nha-mt-ly-thai-to-quan-1-dt-8x16m-7tang-hdt-175tr-thang-chi-55-ty-18173030.html,Cần Bán Tòa nhà MT Lý Thái Tổ_Quận 1- DT: 8x16m_7Tầng_HĐT 175tr/tháng_Chỉ 55 tỷ,2026-06-10,đường lý thái tổ,"Đường Lý Thái Tổ, Phường 2, Quận 10, Hồ Chí Minh (cũ)",phường vườn lài,hồ chí minh,18173030,unknown,can_ban,nha_mat_tien,unknown,7.0,7.0,30.0,8.0,16.0,55000000000.0,93.0,0,0,0,0,0,"1,28",81.309,10.768525,106.6724938,"đường lý thái tổ, phường vườn lài, hồ chí minh, Vietnam",3.2419722128438297,0.3010820874778004,222.0,0.2811142836074399,87.0,0.2622385558569263,54.0,0.3931772678968423,92.0,0.3926340325942063,11.0,0.1032738006671135,74.0,2.789766515743807,3.0
https://alonhadat.com.vn/-nha-goc-2-mat-tien-bui-thi-xuan-quan-1-24x24m-thu-nhap-20-000-usd-gia-ban-360-17323812.html,🔥Siêu Phẩm GÓC 2MT  SƯƠNG NGUYỆT ÁNH - TÔN THẤT TÙNG 24x20m HĐ 20K CHỈ 360 TỶ,2026-06-10,đường bùi thị xuân,"Đường Bùi Thị Xuân, Phường Bến Thành, Quận 1, Hồ Chí Minh (cũ)",phường bến thành,hồ chí minh,17323812,dong_nam,can_ban,nha_mat_tien,unknown,3.0,3.0,20.0,24.0,20.0,360000000000.0,576.0,0,0,0,0,0,"1,85",38.809,11.0701042,106.6808337,"đường bùi thị xuân, phường bến thành, hồ chí minh, Vietnam",32.50663227168524,0.4219382907302517,6.0,2.3911776459739493,1.0,1.0604627294719566,2.0,5.0,0.0,2.75973642044358,1.0,0.0872185535609212,15.0,5.0,0.0
https://alonhadat.com.vn/-danh-cho-dau-tu-biet-thu-re-nhat-sg-pearl-dt-7x21m-ham-4-lau-full-nt-giam-sau-86-ty-18215421.html,🔥Dành Cho Đầu Tư - Biệt Thự Rẻ Nhất SG Pearl DT 7x21m Hầm 4 Lầu Full NT Giảm Sâu 86 tỷ,2026-06-10,đường nguyễn hữu cảnh,"Đường Nguyễn Hữu Cảnh, Phường 22, Quận Bình Thạnh, Hồ Chí Minh (cũ)",phường thạnh mỹ tây,hồ chí minh,18215421,dong_nam,can_ban,nha_mat_tien,so_hong_so_do,5.0,5.0,20.0,7.0,21.0,86000000000.0,147.0,0,0,0,0,0,"4,40",34.822,10.7943816,106.7196667,"đường nguyễn hữu cảnh, phường thạnh mỹ tây, hồ chí minh, Vietnam",2.819869535506374,0.4688903098431907,72.0,2.095477956199122,32.0,0.430676783888593,12.0,0.209155755069741,40.0,1.6557303920489614,6.0,0.1768140661892192,22.0,0.4912639714031474,8.0
https://alonhadat.com.vn/re-hon-tt-15-ban-gap-sieu-vi-tri-mt-tu-xuong-q-3-20x46m-3-lau-hd-450-trieu-chi-560-ty-18226584.html,Rẻ Hơn TT 20% Bán Gấp Siêu Vị Trí MT Tú Xương Q.3 20x46m 3 Lầu HĐ 500 Triệu Chỉ 530 Tỷ,2026-06-10,đường tú xương,"Đường Tú Xương, Phường Võ Thị Sáu, Quận 3, Hồ Chí Minh (cũ)",phường xuân hòa,hồ chí minh,18226584,dong_nam,can_ban,nha_mat_tien,so_hong_so_do,4.0,4.0,25.0,20.0,46.0,530000000000.0,910.0,0,0,0,0,0,"2,22",21.831,10.7774792,106.6833568,"đường tú xương, phường xuân hòa, hồ chí minh, Vietnam",1.9197483044424144,0.1874054406629287,194.0,0.2209052068703876,86.0,0.4482460908087723,46.0,0.2533031865061314,115.0,0.3051883383569894,18.0,0.0900876516922675,77.0,1.7452396905210976,5.0
https://alonhadat.com.vn/ban-nha-156-158-nguyen-thai-binh-phuong-ben-thanh-dt-7-4x18m-hdt-200tr-gia-130-ty-18172887.html,Bán nhà 156 158 Nguyễn Thái Bình Phường Bến Thành_DT: 7.4x18m_HĐT 200TR_Gía 130 tỷ,2026-06-10,đường nguyễn thái bình,"Đường Nguyễn Thái Bình, Phường Bến Thành, Quận 1, Hồ Chí Minh (cũ)",phường bến thành,hồ chí minh,18172887,unknown,can_ban,nha_mat_tien,unknown,2.0,2.0,30.0,7.4,18.0,130000000000.0,123.0,0,0,0,0,0,"1,85",38.809,10.7699914,106.7012949,"Đường Nguyễn Thái Bình, Phường Bến Thành, Quận 1, Hồ Chí Minh, Vietnam",0.7654010999893194,0.1336283617641847,133.0,0.2983453012928557,86.0,0.2835981344744774,37.0,0.2573833893348386,91.0,0.2925486686973241,17.0,0.0979740920969244,101.0,0.387896680854281,6.0
https://alonhadat.com.vn/no-bank-co-hoi-duy-nhat-so-huu-toa-nha-mt-cong-hoa-dt-30x40m-vv-1-200m2-chi-230-ty-18245597.html,Nợ Bank Cơ Hội Duy Nhất Sở Hữu Tòa Nhà MT Công Hòa DT 30x40m VV 1.200m2 Chỉ 230 Tỷ,2026-06-10,đường cộng hòa,"Đường Cộng Hòa, Phường 12, Quận Tân Bình, Hồ Chí Minh (cũ)",phường bảy hiền,hồ chí minh,18245597,dong_nam,can_ban,nha_mat_tien,so_hong_so_do,2.0,2.0,60.0,30.0,40.0,23000000000.0,1200.0,0,0,0,0,0,"2,86",46.242,10.8037774,106.6527868,"đường cộng hòa, phường bảy hiền, hồ chí minh, Vietnam",6.043659430230211,0.4775877456713334,112.0,1.0736064671891512,48.0,0.8914489704506288,16.0,1.38785428191484,24.0,0.3236873794330893,4.0,0.2866893324088378,16.0,5.0,0.0
https://alonhadat.com.vn/-sieu-hot-mt-truc-chinh-vu-tong-phan-da-an-phu-new-city-7x24m-165m2-4l-moi-gia-50-ty-18660635.html,🔥 Siêu Hot MT Trục Chính  Vũ Tông Phan - DA An Phú New City 7x24m 165m2 4L Mới Giá 50 Tỷ,2026-06-10,đường vũ tông phan,"Đường Vũ Tông Phan, Phường An Phú, Thành phố Thủ Đức, Hồ Chí Minh (cũ)",phường an khánh,hồ chí minh,18660635,dong_nam,can_ban,nha_mat_tien,so_hong_so_do,4.0,4.0,30.0,7.0,25.0,50000000000.0,165.0,0,0,0,0,0,"15,33",5.021,10.7850885,106.7293654,"phường an khánh, hồ chí minh, Vietnam",3.242272702926816,0.4644541079433794,53.0,1.7631624559602346,30.0,0.9995120096449168,11.0,0.8095548246772732,32.0,1.6542081149097525,6.0,0.0886730542335018,24.0,1.6366304217425418,8.0
https://alonhadat.com.vn/sieu-hiem-mt-ngay-cong-dh-hutech-via-he-20m-mt-dien-bien-phu-bt-4-5x23m-5l-chi-40-ty-18567483.html,Siêu Hiếm MT Ngay Cổng ĐH Hutech - Vỉa Hè 20m - MT Điện Biên Phủ BT 4.5x23m 5L Chỉ 40 Tỷ,2026-06-10,đường điện biên phủ,"Đường Điện Biên Phủ, Phường 25, Quận Bình Thạnh, Hồ Chí Minh (cũ)",phường thạnh mỹ tây,hồ chí minh,18567483,dong_nam,can_ban,nha_mat_tien,so_hong_so_do,5.0,5.0,60.0,4.5,23.0,40000000000.0,100.0,0,0,0,0,0,"4,40",34.822,10.8020717,106.7129708,"đường điện biên phủ, phường thạnh mỹ tây, hồ chí minh, Vietnam",3.08142096105369,0.4804866922410259,90.0,1.829759689630963,39.0,0.8575154738577684,14.0,0.906582103041264,53.0,2.2101636269811404,4.0,0.0452518010898517,50.0,0.7209713695364175,8.0
https://alonhadat.com.vn/ban-nha-mat-tien-phan-dinh-phung-p17-phu-nhuan-hdt-170tr-dt-9-x-16m-ham-4-lau-42-ty-18172871.html,Bán Nhà Mặt Tiền\ Phan Đình Phùng_P17_Phú Nhuận_HĐT 170Tr_DT: 9 x 16m_Hầm + 4 lầu_42 tỷ,2026-06-10,đường phan đình phùng,"Đường Phan Đình Phùng, Phường 17, Quận Phú Nhuận, Hồ Chí Minh (cũ)",phường cầu kiệu,hồ chí minh,18172871,unknown,can_ban,nha_mat_tien,unknown,4.0,4.0,20.0,9.0,16.0,42000000000.0,155.0,0,0,0,0,0,"1,23",50.946,10.7951863,106.6840954,"đường phan đình phùng, phường cầu kiệu, hồ chí minh, Vietnam",2.73294969497402,0.268345803701012,156.0,0.7440297882213216,80.0,0.2040724850715341,24.0,0.3278271927366389,68.0,2.008188119285779,6.0,0.1177164242699256,39.0,2.949688319556361,5.0
https://alonhadat.com.vn/ban-nha-goc-2mt-tran-quoc-thao-phuong-vts-quan-3-dt-14-x-28m-hdt-420tr-th-16154098.html,Siêu Vị Trí Góc 2MT Trần Quốc Thảo Lý Chính Thắng Q3 DT 15x28m H4L HĐ 420 Tr Chỉ 300 Tỷ,2026-06-10,đường trần quốc thảo,"Đường Trần Quốc Thảo, Phường Võ Thị Sáu, Quận 3, Hồ Chí Minh (cũ)",phường xuân hòa,hồ chí minh,16154098,unknown,can_ban,nha_mat_tien,so_hong_so_do,3.0,3.0,30.0,15.0,28.0,300000000000.0,412.0,0,0,0,0,0,"2,22",21.831,10.7824046,106.6895335,"phường xuân hòa, hồ chí minh, Vietnam",1.3842360927551391,0.1362858508209465,177.0,0.392725688709276,81.0,0.8309996539468081,44.0,0.306041499917031,114.0,0.4875412983036777,17.0,0.0903504268932904,90.0,1.56192760975934,5.0
https://alonhadat.com.vn/ban-nha-mat-tien-126-nguyen-xi-p26-binh-thanh-dt-5-5-x-29m-ham-8lau-hdt-165tr-th-55-ty-18172852.html,Bán Nhà Mặt Tiền 126 Nguyễn Xí_P26_Bình Thạnh_ DT: 5.5 x 29m_Hầm + 8Lầu_HĐT 165Tr/th_55 Tỷ,2026-06-10,đường nguyễn xí,"Đường Nguyễn Xí, Phường 26, Quận Bình Thạnh, Hồ Chí Minh (cũ)",phường bình thạnh,hồ chí minh,18172852,unknown,can_ban,nha_mat_tien,unknown,8.0,8.0,30.0,5.5,29.0,55000000000.0,159.0,0,0,0,0,0,"3,32",38.042,10.8159726,106.708611,"đường nguyễn xí, phường bình thạnh, hồ chí minh, Vietnam",4.403449136661228,0.0775693332154124,79.0,1.857049321934012,30.0,0.7457558925444734,14.0,0.5762497725284922,36.0,1.91660102856126,2.0,0.138964276982038,35.0,2.3286186252093537,6.0
https://alonhadat.com.vn/-oanh-an-cu-go-vap-ban-gap-mat-tien-kd-khung-chdv0-18772327.html,🌹Oanh An Cư 🌹 GÒ VẤP 🔥 BÁN GẤP MẶT TIỀN KD KHỦNG _ CHDV0,2026-06-10,đường nguyễn kiệm,"Đường Nguyễn Kiệm, Phường Hạnh Thông, Quận Gò Vấp, Hồ Chí Minh (cũ)",phường hạnh thông,hồ chí minh,18772327,unknown,can_ban,nha_mat_tien,so_hong_so_do,4.0,9.0,12.0,4.0,17.5,18000000000.0,70.0,1,1,0,0,0,"3,37",38.239,10.8242519,106.6791786,"đường nguyễn kiệm, phường hạnh thông, hồ chí minh, Vietnam",5.751245398699621,0.6964602466870589,69.0,0.6687806167636219,29.0,0.8832379121828587,9.0,0.6634363442799482,18.0,0.185800056708459,7.0,0.0634399151916361,43.0,5.0,0.0
https://alonhadat.com.vn/ban-nha-mt-tan-cang-p25-binh-thanh-dt-12x25-cn-250m2-ket-cau-9-tang-hdt-250tr-75-ty-18172837.html,"Bán nhà MT Tân Cảng P25 Bình Thạnh, DT: 12x25 CN 250m2 kết cấu: 9 tầng - HDT 250tr_75 tỷ",2026-06-10,đường kênh tân hóa,"Đường Kênh Tân Hóa, Phường Tân Phú, Quận Tân Phú, Hồ Chí Minh (cũ)",phường tân phú,hồ chí minh,18172837,unknown,can_ban,nha_mat_tien,unknown,9.0,9.0,30.0,12.0,25.0,75000000000.0,250.0,0,0,0,0,0,"2,52",36.951,10.778257,106.6398057,"đường kênh tân hóa, phường tân phú, hồ chí minh, Vietnam",6.683488244232732,0.2491433478382603,159.0,0.3814250554219041,62.0,0.3396149172936501,32.0,0.5580656653798234,30.0,2.88597756226286,2.0,0.1872975460726369,44.0,5.0,0.0
https://alonhadat.com.vn/ban-nha-mat-tien-263-tran-quang-khai-p-tan-dinh-quan-1-18172828.html,"Bán Nhà Mặt Tiền 263 Trần Quang Khải, P. Tân Định, Quận 1",2026-06-10,đường trần quang khải,"Đường Trần Quang Khải, Phường Tân Định, Quận 1, Hồ Chí Minh (cũ)",phường tân định,hồ chí minh,18172828,unknown,can_ban,nha_mat_tien,unknown,4.0,4.0,30.0,4.69,18.0,32000000000.0,85.0,0,0,0,0,0,"1,23",39.45,10.7918897,106.689508,"đường trần quang khải, phường tân định, hồ chí minh, Vietnam",2.0739872715422014,0.2137503907451038,145.0,0.1868729476283893,77.0,0.2279879293529763,27.0,0.0804963877683513,98.0,1.533984909121416,13.0,0.0884775372432746,41.0,2.291945969640861,6.0
https://alonhadat.com.vn/sieu-vi-tri-mt-40-40a-phan-dinh-phung-phu-nhuan-dt-8x23m-ctxd-cao-tang-gia-chi-66-ty-18172813.html,Siêu vị trí MT 40-40A Phan Đình Phùng_Phú Nhuận DT: 8x23m CTXD Cao Tầng_Gía chỉ 66 tỷ,2026-06-10,đường phan đình phùng,"Đường Phan Đình Phùng, Phường 2, Quận Phú Nhuận, Hồ Chí Minh (cũ)",phường cầu kiệu,hồ chí minh,18172813,unknown,can_ban,nha_mat_tien,unknown,4.0,4.0,30.0,8.0,23.0,66000000000.0,188.0,0,0,0,0,0,"1,23",50.946,10.7951863,106.6840954,"đường phan đình phùng, phường cầu kiệu, hồ chí minh, Vietnam",2.73294969497402,0.268345803701012,156.0,0.7440297882213216,80.0,0.2040724850715341,24.0,0.3278271927366389,68.0,2.008188119285779,6.0,0.1177164242699256,39.0,2.949688319556361,5.0
https://alonhadat.com.vn/ban-nha-go-vap-mat-tien-duong-pham-van-chieu-phuong-16-nay-la-p-an-hoi-dong-18772544.html,"Bán nhà Gò Vấp ,Mặt tiền đường Phạm Văn Chiêu Phường 16 nay là P. An Hội Đông",2026-06-10,đường phạm văn chiêu,"Đường Phạm Văn Chiêu, Phường An Hội Đông, Quận Gò Vấp, Hồ Chí Minh (cũ)",phường an hội đông,hồ chí minh,18772544,bac,can_ban,nha_mat_tien,so_hong_so_do,4.0,6.0,20.0,4.0,23.0,13900000000.0,60.0,1,1,1,1,0,"3,29",34.553,10.8469903,106.6454907,"đường phạm văn chiêu, phường an hội đông, hồ chí minh, Vietnam",9.83989721181208,0.2990800904706439,59.0,2.2267740055199403,9.0,0.5883552565511162,6.0,0.587367055666275,9.0,3.535477445553667,0.0,0.0,22.0,5.0,0.0
https://alonhadat.com.vn/ban-nha-mat-tien-121-le-thi-bach-cat-q11-dt-4-6x18-5-2-tang-gia-ban-15-ty-tl-18773588.html,"BÁN NHÀ MẶT TIỀN 121 LÊ THỊ BẠCH CÁT , Q11. DT: 4.6x18.5 , 2 TẦNG , GIÁ BÁN 15 TỶ TL",2026-06-10,đường lê thị bạch cát,"Đường Lê Thị Bạch Cát, Phường 13, Quận 11, Hồ Chí Minh (cũ)",phường phú thọ,hồ chí minh,18773588,unknown,can_ban,nha_mat_tien,so_hong_so_do,2.0,4.0,16.0,4.6,17.2,15000000000.0,72.0,1,1,1,1,0,"1,37",47.715,10.7647248,106.6508436,"đường lê thị bạch cát, phường phú thọ, hồ chí minh, Vietnam",5.637934363670447,0.2615809576671059,212.0,0.5500086306022813,74.0,0.2914328326505966,55.0,0.7164280401893546,33.0,1.2584263722319429,5.0,0.1784395162217008,76.0,5.0,0.0
https://alonhadat.com.vn/chinh-chu-gui-ban-nha-90m2-binh-loi-5-tang-13-5-ty-tl-18467269.html,Chính chủ gửi bán nhà 90m2 Bình Lợi 5 tầng 13.5 tỷ TL,2026-06-10,đường bình lợi,"Đường Bình Lợi, Phường 13, Quận Bình Thạnh, Hồ Chí Minh (cũ)",phường bình lợi trung,hồ chí minh,18467269,unknown,can_ban,nha_mat_tien,so_hong_so_do,5.0,4.0,8.0,4.5,20.0,13500000000.0,90.0,1,1,1,1,0,"3,89",29.851,10.8115302,106.6884672,"đường bình lợi, phường bình lợi trung, hồ chí minh, Vietnam",4.064716232642971,0.4619220718864422,102.0,0.8817790947355233,45.0,0.3362491145783894,14.0,0.755905384809705,46.0,1.794439650391342,7.0,0.224002530517656,39.0,3.416643420816238,5.0
https://alonhadat.com.vn/sieu-khan-hiem-toa-nha-goc-2-mat-tien-nguyen-thi-minh-khai-quan-3-giam-chi-con-75-ty--18772639.html,"SIÊU KHAN HIẾM TÒA NHÀ GÓC 2 MẶT TIỀN NGUYỄN THỊ MINH KHAI, QUẬN 3 - GIẢM CHỈ CÒN 75 TỶ.",2026-06-10,đường nguyễn thị minh khai,"Đường Nguyễn Thị Minh Khai, Phường Võ Thị Sáu, Quận 3, Hồ Chí Minh (cũ)",phường xuân hòa,hồ chí minh,18772639,dong_nam,can_ban,nha_mat_tien,so_hong_so_do,7.0,7.0,40.0,4.5,25.0,75000000000.0,97.0,0,0,0,0,0,"2,22",21.831,10.7822908,106.6975437,"đường nguyễn thị minh khai, phường xuân hòa, hồ chí minh, Vietnam",0.7002194097271878,0.2482721171246891,137.0,0.320455935373218,80.0,1.0764179936885112,30.0,0.3235216325712516,109.0,0.938955233682222,17.0,0.0909325615245316,91.0,0.91775305680805,6.0
https://alonhadat.com.vn/quy-dat-vang-nguyen-cong-tru-quan-1-ngang-8-6m-hiem-co-chot-chi-105-ty--18772671.html,QUỸ ĐẤT VÀNG NGUYỄN CÔNG TRỨ – QUẬN 1 – NGANG 8.6M HIẾM CÓ – CHỐT CHỈ 105 TỶ.,2026-06-10,đường nguyễn công trứ,"Đường Nguyễn Công Trứ, Phường Bến Thành, Quận 1, Hồ Chí Minh (cũ)",phường bến thành,hồ chí minh,18772671,tay_nam,can_ban,nha_mat_tien,so_hong_so_do,1.0,1.0,20.0,8.6,19.0,105000000000.0,160.0,0,0,0,0,0,"1,85",38.809,10.7923307,106.710214,"đường nguyễn công trứ, hồ chí minh, Vietnam",1.987691476481848,0.1649103812535736,97.0,1.4498165760648885,49.0,0.2933004039499611,15.0,0.1553468981741968,61.0,2.1067582884953944,12.0,0.0902547823783499,42.0,0.7103435609789256,7.0
https://alonhadat.com.vn/ban-nha-mat-tien-bau-cat-p14-tan-binh-dt-4x14m-gia-tot-chi-12-6-ty-lh-kim-xem-nha--18107502.html,Bán nhà Mặt Tiền Bàu Cát P14 Tân Bình DT :4x14m Giá tốt chỉ 13.6 tỷ (LH KIM xem nhà ),2026-06-10,đường bàu cát,"Đường Bàu Cát, Phường 14, Quận Tân Bình, Hồ Chí Minh (cũ)",phường tân bình,hồ chí minh,18107502,unknown,can_ban,nha_mat_tien,unknown,1.0,2.0,10.0,4.0,14.0,13600000000.0,56.0,0,0,0,0,0,"2,12",42.157,10.7878255,106.6438598,"đường bàu cát, phường tân bình, hồ chí minh, Vietnam",6.35429173474454,0.1750195304360008,153.0,0.5225105240070275,61.0,0.45950139405485,28.0,0.4906634202464263,27.0,1.753596535716645,2.0,0.0941272756655079,48.0,5.0,0.0
https://alonhadat.com.vn/tai-san-hiem-ban-khuon-dat-hung-vuong-quan-5-14-5m-x-36m-ctxd-cao-gia-150-ty-18773572.html,"Tài Sản Hiếm ! Bán Khuôn Đất Hùng Vương - Quận 5. 14,5m x 36m. CTXD Cao - Giá 150 Tỷ",2026-06-10,đường hùng vương,"Đường Hùng Vương, Phường 9, Quận 5, Hồ Chí Minh (cũ)",phường an đông,hồ chí minh,18773572,unknown,can_ban,nha_mat_tien,unknown,4.0,5.0,16.0,12.382783747337808,37.14835124201342,150000000000.0,460.0,0,0,0,0,0,"1,32",61.537,10.7568469,106.6678439,"đường hùng vương, phường an đông, hồ chí minh, Vietnam",4.241632920220055,0.1536280542554851,207.0,0.2185477663911899,80.0,0.494725317522057,52.0,0.4600111657216837,53.0,0.5533080642496575,11.0,0.0896271834902142,88.0,3.636965641370865,2.0
https://alonhadat.com.vn/ban-nha-dang-thuy-tram-4x17m-tret-2-lau-san-thuong-4pn-5wc-gia-re-chi-8-5-ty--11879764.html,"Bán Nhà Đặng Thùy Trâm 4x17m Trệt 2 Lầu Sân Thượng, 4PN,5WC giá rẻ chỉ 12.5 tỷ.",2026-06-10,đường đặng thuỳ trâm,"Đường Đặng Thuỳ Trâm, Phường 13, Quận Bình Thạnh, Hồ Chí Minh (cũ)",phường bình lợi trung,hồ chí minh,11879764,unknown,can_ban,nha_mat_tien,so_hong_so_do,4.0,4.0,8.0,4.0,17.0,12000000000.0,68.0,0,0,0,0,0,"3,89",29.851,10.8267759,106.7019635,"đường đặng thuỳ trâm, phường bình lợi trung, hồ chí minh, Vietnam",5.518162999413561,0.3229844614613355,52.0,1.7872345276552803,23.0,0.6863846982219879,8.0,0.7441141835754278,26.0,2.1428895093998177,6.0,0.2216411070038452,25.0,3.706835542545565,4.0
