link,title,post_day,street,old_address,locality,region,listing_id,direction,listing_type,property_type,legal_status,num_floors,num_bedrooms,road_width_m,width_m,length_m,price_vnd,area_m2,dining_room_bin,kitchen_bin,terrace_bin,car_parking_bin,owner_listing_bin,locality_square,locality_population_density,lat,lon,matched_address,distance_to_center_km,nearest_school_km,school_count_3km,nearest_hospital_km,hospital_count_5km,nearest_marketplace_km,marketplace_count_3km,nearest_supermarket_km,supermarket_count_3km,nearest_mall_km,mall_count_3km,nearest_bus_stop_km,bus_stop_count_1km,nearest_metro_km,metro_count_5km
https://alonhadat.com.vn/giam-manh-con-37-ty-tl-mat-tien-su-van-hanh-q10-5-tang-18771755.html,"GIẢM MẠNH CÒN 37 TỶ TL – MẶT TIỀN SƯ VẠN HẠNH, Q10  5 TẦNG",2026-06-10,đường sư vạn hạnh,"Đường Sư Vạn Hạnh, Phường 12, Quận 10, Hồ Chí Minh (cũ)",phường hòa hưng,hồ chí minh,18771755,unknown,can_ban,nha_mat_tien,so_hong_so_do,5.0,10.0,30.0,4.0,20.0,37000000000.0,80.0,0,0,0,0,0,"2,59",37.225,10.7723361,106.6693289,"đường sư vạn hạnh, phường hòa hưng, hồ chí minh, Vietnam",3.4896314837271905,0.1530602141866319,221.0,0.1387529508820801,88.0,0.2020532388344237,50.0,0.1989929428236456,79.0,0.196477516915869,9.0,0.3228836002677692,50.0,3.126753567830713,3.0
https://alonhadat.com.vn/ban-nha-mat-tien-phan-dang-luu-q-binh-thanh-16m-x-42m-1-ham-10-tang-gia-210-ty-18706239.html,"Bán nhà Mặt tiền Phan Đăng Lưu, Q.Bình Thạnh - 16m x 42m - 1 Hầm 10 Tầng - Giá 210 Tỷ",2026-06-10,đường phan đăng lưu,"Đường Phan Đăng Lưu, Phường Bình Thạnh, Quận Bình Thạnh, Hồ Chí Minh (cũ)",phường bình thạnh,hồ chí minh,18706239,unknown,can_ban,nha_mat_tien,unknown,10.0,50.0,50.0,14.742229591663987,44.22668877499196,210000000000.0,652.0,0,0,0,0,0,"3,32",38.042,10.8024757,106.6972461,"đường phan đăng lưu, phường bình thạnh, hồ chí minh, Vietnam",2.857093411906882,0.1198510656912059,124.0,0.3043129450936367,50.0,0.1929703205143117,16.0,0.323359216041417,64.0,2.813722630528409,1.0,0.0154321154091965,40.0,2.119420370147663,7.0
https://alonhadat.com.vn/ban-nha-mat-tien-pasteur-quan-3-dt-9x37m-no-hau-18m-co-hem-hong-6m-2-tang-san-vuon-18622413.html,"Bán nhà mặt tiền Pasteur, Quận 3 – dt: 9x37m nở hậu 18m có hẻm hông 6m 2 tầng sân vườn",2026-06-10,đường pasteur,"Đường Pasteur, Phường Võ Thị Sáu, Quận 3, Hồ Chí Minh (cũ)",phường xuân hòa,hồ chí minh,18622413,unknown,can_ban,nha_mat_tien,unknown,2.0,6.0,50.0,11.547005383792516,34.64101615137754,220000000000.0,400.0,0,0,0,0,0,"2,22",21.831,10.7814599,106.6948412,"đường pasteur, phường xuân hòa, hồ chí minh, Vietnam",0.8327634734912616,0.0665123069481957,146.0,0.2778428816547894,80.0,1.042820855434742,36.0,0.1881578087546907,111.0,0.6408334228349923,17.0,0.0247474985102759,101.0,1.0433100526543433,6.0
https://alonhadat.com.vn/mat-tien-duong-lon-sat-ngay-au-co-dt-lon-22x60m-1200m-gia-tot-129-ty-18731886.html,Mặt tiền đường lớn sát ngay Âu Cơ. DT lớn 22x60m 1200m²  Giá tốt 129 tỷ,2026-06-10,đường âu cơ,"Đường Âu Cơ, Phường 10, Quận Tân Bình, Hồ Chí Minh (cũ)",phường bảy hiền,hồ chí minh,18731886,unknown,can_ban,nha_mat_tien,unknown,1.0,6.0,30.0,20.0,60.0,129000000000.0,1200.0,0,0,0,0,0,"2,86",46.242,10.7832537,106.6433391,"đường âu cơ, phường bảy hiền, hồ chí minh, Vietnam",6.334415958719388,0.2343757036700277,160.0,0.1580566936969379,63.0,0.3352170637372856,31.0,0.8113542319294583,29.0,2.2149079359132777,2.0,0.074065013357784,45.0,5.0,0.0
https://alonhadat.com.vn/re-hon-tt-30-ban-gap-sieu-vi-tri-mt-tu-xuong-q-3-20x46m-3-lau-hd-450-trieu-chi-520-ty-18736687.html,Rẻ Hơn TT 30% Bán Gấp Siêu Vị Trí MT Tú Xương Q.3 20x46m 3 Lầu HĐ 450 Triệu Chỉ 520 Tỷ,2026-06-10,đường tú xương,"Đường Tú Xương, Phường Xuân Hòa, Quận 3, Hồ Chí Minh (cũ)",phường xuân hòa,hồ chí minh,18736687,unknown,can_ban,nha_mat_tien,unknown,2.0,12.0,30.0,17.416467303484175,52.24940191045253,520000000000.0,910.0,0,0,0,0,0,"2,22",21.831,10.7774792,106.6833568,"đường tú xương, phường xuân hòa, hồ chí minh, Vietnam",1.9197483044424144,0.1874054406629287,194.0,0.2209052068703876,86.0,0.4482460908087723,46.0,0.2533031865061314,115.0,0.3051883383569894,18.0,0.0900876516922675,77.0,1.7452396905210976,5.0
https://alonhadat.com.vn/-sieu-vi-tri-mt-ly-tu-trong-gan-cho-ben-thanh-200m-dt-4-3x29m-3l-moi-chi-75-ty-18773746.html,🔥Siêu Vị Trí - MT Lý Tự Trọng Gần Chợ Bến Thành 200m DT: 4.3x29m 3L Mới Chỉ 78 Tỷ,2026-06-10,đường lý tự trọng,"Đường Lý Tự Trọng, Phường Bến Thành, Quận 1, Hồ Chí Minh (cũ)",phường bến thành,hồ chí minh,18773746,dong,can_ban,nha_mat_tien,so_hong_so_do,3.0,3.0,20.0,4.3,29.0,75000000000.0,125.0,0,0,0,0,0,"1,85",38.809,10.9981309,106.723075,"đường lý tự trọng, hồ chí minh, Vietnam",24.59101070819736,0.6290161608231251,8.0,2.774243202205949,1.0,0.8004417037999099,2.0,0.7800807672531259,1.0,5.0,0.0,1.5554954475703735,0.0,5.0,0.0
https://alonhadat.com.vn/ban-nha-ngang-9-5m-dai-41m-mt-ly-thuong-kiet-p7-tb-thich-hop-dau-tu-xay-cao-oc-vp-gia-7986166.html,"Bán nhà ngang 9.5m dài 41m MT Lý Thường Kiệt, P7, TB, thích hợp đầu tư xây cao ốc VP, giá",2026-06-10,đường lý thường kiệt,"Đường Lý Thường Kiệt, Phường 7, Quận Tân Bình, Hồ Chí Minh (cũ)",phường tân sơn nhất,hồ chí minh,7986166,unknown,can_ban,nha_mat_tien,unknown,6.0,14.0,100.0,11.105554165971787,33.31666249791537,94000000000.0,370.0,0,0,0,0,0,"3,19",26.533,10.7899758,106.6526154,"đường lý thường kiệt, phường tân sơn nhất, hồ chí minh, Vietnam",5.475212552227916,0.1406938955874308,161.0,0.1586642428394363,74.0,0.4373535890395822,28.0,0.585624770174733,39.0,1.1940425354312303,4.0,0.1382347647324017,32.0,5.0,0.0
https://alonhadat.com.vn/ban-nha-mat-tien-thi-sach-p-ben-nghe-quan-1-dt-6x19m-4-lau-75-ty-tl--8174508.html,"Bán nhà mặt tiền Thi Sách, P. Bến Nghé, Quận 1. DT: 6x19m, 4 lầu, 75 tỷ (TL)",2026-06-10,đường thi sách,"Đường Thi Sách, Phường Bến Nghé, Quận 1, Hồ Chí Minh (cũ)",phường sài gòn,hồ chí minh,8174508,unknown,can_ban,nha_mat_tien,unknown,4.0,5.0,5.0,6.164414002968976,18.49324200890693,75000000000.0,114.0,0,0,0,0,0,"3,04",15.468,11.0581861,106.6883475,"đường thi sách, phường sài gòn, hồ chí minh, Vietnam",31.14445821763877,0.5747375177473488,5.0,3.435008610741125,2.0,2.0467190691331703,2.0,5.0,0.0,1.7714235804964815,1.0,0.1620549832234892,37.0,5.0,0.0
https://alonhadat.com.vn/ban-nha-mt-duong-duong-tu-giang-9-5m-x-21m-nha-cap-4-gia-chi-42-5-ty-8710438.html,"Bán nhà MT đường Dương Tử Giang (9.5m x 21m), . nhà cấp 4. giá chỉ : 42.5 tỷ",2026-06-10,đường dương tử giang,"Đường Dương Tử Giang, Phường 14, Quận 5, Hồ Chí Minh (cũ)",phường chợ lớn,hồ chí minh,8710438,unknown,can_ban,nha_mat_tien,unknown,1.0,2.0,20.0,9.5,20.0,42500000000.0,200.0,0,0,0,0,0,"1,67",50.938,10.7529153,106.6552589,"đường dương tử giang, phường chợ lớn, hồ chí minh, Vietnam",5.653117086348818,0.1429433667892032,196.0,0.593520017288262,70.0,0.3261718920857768,50.0,0.8599569783498476,30.0,0.1495715995685519,7.0,0.1405816542054276,74.0,5.070800351286287,1.0
https://alonhadat.com.vn/vi-tri-dep-goc-2-mt-phan-dang-luu-nguyen-van-dau-pn-11x19m-cho-thue-180-trieu-thang-5-11766298.html,"Vị trí đẹp! Góc 2 MT Phan Đăng Lưu - Nguyễn Văn Đậu PN 11x19m, 52 tỷ",2026-06-10,đường phan đăng lưu,"Đường Phan Đăng Lưu, Phường 5, Quận Phú Nhuận, Hồ Chí Minh (cũ)",phường đức nhuận,hồ chí minh,11766298,unknown,can_ban,nha_mat_tien,unknown,3.0,7.0,10.0,8.34665601703261,25.03996805109783,52000000000.0,209.0,0,0,0,0,0,"2,17",32.947,10.8050189,106.6856946,"đường phan đăng lưu, phường đức nhuận, hồ chí minh, Vietnam",3.526954400701507,0.1175141904538145,128.0,0.1697385585509312,52.0,0.4514166541448588,18.0,0.7759415491050107,56.0,2.3497406593452834,6.0,0.1136563562267956,32.0,3.4075937654659247,5.0
https://alonhadat.com.vn/goc-2mt-tran-binh-trong-quan-5-12x20m-6-tang-hdt-200-trieu-75-ty-chinh-chu--12928436.html,"Góc 2MT Trần Bình Trọng, Quận 5 - 12x20m - 6 tầng - HĐT 200 triệu - 75 tỷ",2026-06-10,đường trần bình trọng,"Đường Trần Bình Trọng, Phường 3, Quận 5, Hồ Chí Minh (cũ)",phường chợ quán,hồ chí minh,12928436,unknown,can_ban,nha_mat_tien,unknown,2.0,6.0,30.0,12.0,20.0,75000000000.0,240.0,0,0,0,0,0,"1,28",49.645,10.7549219,106.6800086,"Đường Trần Bình Trọng, Phường 3, Quận 5, Hồ Chí Minh, Vietnam",3.3363275963647565,0.2318035836389362,171.0,0.1966541649939773,83.0,0.3907399153819134,48.0,0.5360742973986161,82.0,0.8006850539823113,16.0,0.0,75.0,2.6390762487025388,3.0
https://alonhadat.com.vn/mt-cong-hoa-tan-binh-28mx40m-1100m2-xd-2-ham-15-tang-cho-thue-2-ty-th-330-ty-12929826.html,"MT Cộng Hòa, Tân Bình. (28mx40m) 1100m2, XD: 2 hầm 15 tầng, cho thuê 2 tỷ/th - 330 tỷ",2026-06-10,đường cộng hòa,"Đường Cộng Hòa, Phường 13, Quận Tân Bình, Hồ Chí Minh (cũ)",phường tân bình,hồ chí minh,12929826,unknown,can_ban,nha_mat_tien,unknown,10.0,70.0,80.0,28.0,40.0,330000000000.0,1100.0,0,0,0,0,0,"2,12",42.157,11.0727938,106.6998522,"đường cộng hòa, phường tân bình, hồ chí minh, Vietnam",32.73024799248876,0.4800900072813918,5.0,4.4845363613594165,2.0,0.941972746731735,2.0,5.0,0.0,3.8181403719301046,0.0,0.8441691967817977,4.0,5.0,0.0
https://alonhadat.com.vn/chinh-chu-can-ban-nha-goc-2-mt-phan-dang-luu-9-5x24m-2l-hdt-135tr-th-chi-55-ty-tl-12929880.html,cần bán nhà góc 2 MT Phan Đăng Lưu 9.5x24m 2L HĐT: 135tr/th chỉ 55 tỷ TL,2026-06-10,đường phan đăng lưu,"Đường Phan Đăng Lưu, Phường 7, Quận Phú Nhuận, Hồ Chí Minh (cũ)",phường cầu kiệu,hồ chí minh,12929880,unknown,can_ban,nha_mat_tien,giay_to_hop_le,2.0,6.0,80.0,9.5,24.0,55000000000.0,240.0,0,0,0,0,0,"1,23",50.946,10.7994686,106.6825238,"đường phan đăng lưu, phường cầu kiệu, hồ chí minh, Vietnam",3.204820154371627,0.2635712509822548,153.0,0.6525631965622177,64.0,0.4504130592990115,20.0,0.5410249684569507,60.0,2.375241010354709,5.0,0.1388857296812283,36.0,3.422538993510745,5.0
https://alonhadat.com.vn/toa-nha-mt-cach-mang-thang-8-quan-3-15x30m-ham-10-tang-hdt-500-trieu-gia-150-ty-12933451.html,"Tòa nhà MT Cách Mạng Tháng 8, Quận 3 - 15x30m - hầm 10 tầng - HĐT 500 triệu - giá 150 tỷ",2026-06-10,đường cách mạng tháng 8,"Đường Cách Mạng Tháng 8, Phường Võ Thị Sáu, Quận 3, Hồ Chí Minh (cũ)",phường xuân hòa,hồ chí minh,12933451,unknown,can_ban,nha_mat_tien,unknown,10.0,60.0,80.0,15.0,30.0,150000000000.0,470.0,0,0,0,0,0,"2,22",21.831,10.8981083,106.6983431,"đường cách mạng tháng 8, hồ chí minh, Vietnam",13.410194252054774,0.6817252566922732,16.0,1.2387301913476945,6.0,0.569452218686532,3.0,4.058693215801799,0.0,4.0663932539329375,0.0,0.6304134206971885,7.0,5.0,0.0
https://alonhadat.com.vn/mt-nguyen-cuu-van-q-binh-thanh-dt-8mx29m-cn-200m2-h-6-lau-hdt-200tr-th-66-ty-12962820.html,"MT Nguyễn Cửu Vân, Q.Bình Thạnh - DT: 8mX29m. CN: 200m2 - H.6 Lầu - HĐT: 200tr/Th - 66 Tỷ",2026-06-10,đường nguyễn cửu vân,"Đường Nguyễn Cửu Vân, Phường 17, Quận Bình Thạnh, Hồ Chí Minh (cũ)",phường gia định,hồ chí minh,12962820,unknown,can_ban,nha_mat_tien,unknown,6.0,25.0,40.0,8.0,29.0,66000000000.0,200.0,0,0,0,0,0,"2,76",45.633,10.7947837,106.7093255,"đường nguyễn cửu vân, phường gia định, hồ chí minh, Vietnam",2.1822596604592133,0.1711869088091718,99.0,1.4231773041651654,47.0,0.3601758043190207,17.0,0.3160654149244815,56.0,2.343508123557825,12.0,0.0265506988051478,43.0,0.6903391017798891,7.0
https://alonhadat.com.vn/chinh-chu-can-ban-nha-mt-tran-nhat-duat-10mx15m-5-lau-68-ty-tin-that-100--12962913.html,cần bán nhà MT Trần Nhật Duật  10mx15m 5 Lầu- 68 tỷ - tin thật 100%,2026-06-10,đường trần nhật duật,"Đường Trần Nhật Duật, Phường Tân Định, Quận 1, Hồ Chí Minh (cũ)",phường tân định,hồ chí minh,12962913,unknown,can_ban,nha_mat_tien,unknown,5.0,12.0,30.0,10.0,15.0,68000000000.0,150.0,0,0,0,0,0,"1,23",39.45,10.790563,106.6944598,"phường tân định, hồ chí minh, Vietnam",1.6673775677301983,0.1549567259302286,143.0,0.3741840666967297,71.0,0.3125277332072336,26.0,0.2351773259655728,106.0,1.4649799392681575,13.0,0.1158050787162368,56.0,1.8016578982038225,6.0
https://alonhadat.com.vn/ban-mt-luy-ban-bich-tan-phu-dt-13x28m-dts-1500m2-4-lau-thu-3-ty-nam-gia-95-ty-12994908.html,"Bán MT Lũy Bán Bích, Tân Phú - DT: 13x28m. DTS: 1500m2 - 4 lầu - thu 3 tỷ/năm - Giá 95 tỷ",2026-06-10,đường lũy bán bích,"Đường Lũy Bán Bích, Phường Hòa Thạnh, Quận Tân Phú, Hồ Chí Minh (cũ)",phường tân phú,hồ chí minh,12994908,unknown,can_ban,nha_mat_tien,giay_to_hop_le,5.0,20.0,30.0,13.0,28.0,95000000000.0,368.0,0,0,0,0,0,"2,52",36.951,10.7619732,106.6324269,"đường lũy bán bích, phường tân phú, hồ chí minh, Vietnam",7.668862147588211,0.1615875422767095,147.0,1.7000192080960388,48.0,0.6080020120370885,37.0,0.2023167307472264,25.0,2.649891599797064,3.0,0.0180522642569803,36.0,5.0,0.0
https://alonhadat.com.vn/ban-mt-mac-dinh-chi-p-da-kao-q-1-9mx18m-cn-118m2-gpxd-ham-6-lau-gia-45-ty-12994957.html,"Bán MT Mạc Đỉnh Chi, P.Đa Kao, Q.1 - 9mx18m, CN 118m2 - GPXD: Hầm 6 lầu - Giá: 45 tỷ",2026-06-10,đường mạc đĩnh chi,"Đường Mạc Đĩnh Chi, Phường Đa Kao, Quận 1, Hồ Chí Minh (cũ)",phường tân định,hồ chí minh,12994957,unknown,can_ban,nha_mat_tien,giay_to_hop_le,2.0,5.0,20.0,9.0,18.0,45000000000.0,118.0,0,0,0,0,0,"1,23",39.45,11.0333025,106.6213314,"đường mạc đĩnh chi, phường tân định, hồ chí minh, Vietnam",29.66568345474981,2.5315006654904235,3.0,1.3948821195679506,1.0,3.248406294793506,0.0,5.0,0.0,5.0,0.0,1.102204385461861,0.0,5.0,0.0
https://alonhadat.com.vn/ban-2mt-nguyen-dinh-chieu-p-2-q-3-dt-9-5mx22m-nh-12-5m-gpxd-ham-7-lau-96-ty-12995239.html,Bán 2MT Nguyễn Đình Chiểu. P.2 Q.3 - DT:9.5mx22m. NH: 12.5M - GPXD: Hầm + 7 lầu . 96 tỷ,2026-06-10,đường nguyễn đình chiểu,"Đường Nguyễn Đình Chiểu, Phường 2, Quận 3, Hồ Chí Minh (cũ)",phường bàn cờ,hồ chí minh,12995239,unknown,can_ban,nha_mat_tien,unknown,2.0,8.0,20.0,10.0,22.0,96000000000.0,225.0,0,0,0,0,0,"0,99",68.299,10.7717256,106.6840979,"đường nguyễn đình chiểu, phường bàn cờ, hồ chí minh, Vietnam",1.924714076598064,0.2282182092462347,188.0,0.3766118261101341,86.0,0.2001158664426361,44.0,0.1996627877637552,117.0,0.2994541375622043,19.0,0.057193193732501,78.0,1.5101362261367306,4.0
https://alonhadat.com.vn/ban-goc-3mt-to-hien-thanh-p13-q10-9-5mx27m-gpxd-ham-7-lau-95-ty-12995246.html,Bán góc 3MT  Tô Hiến Thành P13 Q10 - 9.5mx27m - GPXD: Hầm + 7 lầu - 95 tỷ,2026-06-10,đường tô hiến thành,"Đường Tô Hiến Thành, Phường 13, Quận 10, Hồ Chí Minh (cũ)",phường hòa hưng,hồ chí minh,12995246,unknown,can_ban,nha_mat_tien,unknown,2.0,5.0,20.0,9.5,27.0,95000000000.0,270.0,0,0,0,0,0,"2,59",37.225,10.7761968,106.6652989,"đường tô hiến thành, phường hòa hưng, hồ chí minh, Vietnam",3.8944351444348873,0.09033164680189,220.0,0.1311023896507005,86.0,0.5132785627783026,45.0,0.1795069716007134,60.0,0.7773015143365518,10.0,0.1571032449174196,35.0,3.610697911008119,3.0
https://alonhadat.com.vn/ban-mt-ung-van-khiem-p-25-binh-thanh-dt-45mx45m-cn-2074m2-gpxd-ham-7-lau-600-ty-12995048.html,Bán MT Ung Văn Khiêm P.25 Bình Thạnh - DT: 45mx45m CN: 2074m2 - GPXD : Hầm 7 lầu - 600 tỷ,2026-06-10,đường ung văn khiêm,"Đường Ung Văn Khiêm, Phường 25, Quận Bình Thạnh, Hồ Chí Minh (cũ)",phường thạnh mỹ tây,hồ chí minh,12995048,unknown,can_ban,nha_mat_tien,unknown,3.0,25.0,30.0,45.0,45.0,600000000000.0,2074.0,0,0,0,0,0,"4,40",34.822,10.8029912,106.7231035,"đường ung văn khiêm, phường thạnh mỹ tây, hồ chí minh, Vietnam",3.77169218113364,0.5231225231110117,67.0,1.2758244586100067,27.0,0.2811217244834689,12.0,0.2030106907357061,36.0,1.1180942600322077,6.0,0.1553214320715076,31.0,0.4872894791132643,9.0
https://alonhadat.com.vn/ban-2mt-ung-van-khiem-p-25-binh-thanh-dt-8mx33m-nh-8-5m-gpxd-ham-7-lau-34-ty-13053953.html,Bán 2MT Ung Văn Khiêm P. 25 Bình Thạnh - DT: 8mx33m NH: 8.5m - GPXD: Hầm + 7 lầu - 34 tỷ,2026-06-10,đường ung văn khiêm,"Đường Ung Văn Khiêm, Phường 25, Quận Bình Thạnh, Hồ Chí Minh (cũ)",phường thạnh mỹ tây,hồ chí minh,13053953,unknown,can_ban,nha_mat_tien,giay_to_hop_le,2.0,6.0,15.0,8.0,33.0,34000000000.0,270.0,0,0,0,0,0,"4,40",34.822,10.8029912,106.7231035,"đường ung văn khiêm, phường thạnh mỹ tây, hồ chí minh, Vietnam",3.77169218113364,0.5231225231110117,67.0,1.2758244586100067,27.0,0.2811217244834689,12.0,0.2030106907357061,36.0,1.1180942600322077,6.0,0.1553214320715076,31.0,0.4872894791132643,9.0
https://alonhadat.com.vn/ban-nha-mt-tran-quoc-toan-p-7-q-3-dt-20mx35m-dtcn-600m2-gpxd-ham-8-tang-220-ty-13053801.html,Bán nhà MT Trần Quốc Toản P.7 Q.3 - DT: 20mx35m. DTCN: 600m2 - GPXD: Hầm 8 tầng. 220 tỷ,2026-06-10,đường trần quốc toản,"Đường Trần Quốc Toản, Phường 7, Quận 3, Hồ Chí Minh (cũ)",phường xuân hòa,hồ chí minh,13053801,unknown,can_ban,nha_mat_tien,giay_to_hop_le,2.0,6.0,15.0,20.0,35.0,220000000000.0,600.0,0,0,0,0,0,"2,22",21.831,10.7887162,106.6892704,"đường trần quốc toản, phường xuân hòa, hồ chí minh, Vietnam",1.8237403887183168,0.0781157192096565,154.0,0.1702853413357628,77.0,0.1563142078690155,34.0,0.3568747167698823,109.0,1.185123965685995,16.0,0.1286395262636042,63.0,2.039668016774165,5.0
https://alonhadat.com.vn/ban-goc-2mt-956-au-co-p-14-tan-binh-dt-12-5mx41m-cn-600m2-gia-giam-110-ty-14092526.html,"Bán góc 2MT 956  Âu Cơ, P.14, Tân Bình - DT: 12.5mX41m, CN: 600m2 - giá giảm 110 tỷ",2026-06-10,đường âu cơ,"Đường Âu Cơ, Phường 14, Quận Tân Bình, Hồ Chí Minh (cũ)",phường tân bình,hồ chí minh,14092526,unknown,can_ban,nha_mat_tien,unknown,1.0,1.0,20.0,12.5,41.0,110000000000.0,600.0,0,0,0,0,0,"2,12",42.157,10.8018262,106.6367417,"đường âu cơ, phường tân bình, hồ chí minh, Vietnam",7.538908010082122,0.3724314368795959,94.0,0.5692125758128943,27.0,0.196513141352012,16.0,0.5905322950264508,16.0,1.780128982414545,3.0,0.1063423521158833,42.0,5.0,0.0
https://alonhadat.com.vn/vi-tri-dep-vip-mt-ly-thai-to-q-3-dt-9mx20m-cn-154m2-3-tang-hdt-100-tr-th-75-ty-14092533.html,"Vị trí đẹp VIP! MT Lý Thái Tổ, Q.3 - DT: 9mx20m. CN: 154m2 - 3 tầng.HĐT: 100 tr/th - 75 tỷ",2026-06-10,đường lý thái tổ,"Đường Lý Thái Tổ, Phường 1, Quận 3, Hồ Chí Minh (cũ)",phường bàn cờ,hồ chí minh,14092533,unknown,can_ban,nha_mat_tien,giay_to_hop_le,2.0,3.0,20.0,9.0,20.0,75000000000.0,154.0,0,0,0,0,0,"0,99",68.299,10.7669784,106.6784211,"đường lý thái tổ, phường bàn cờ, hồ chí minh, Vietnam",2.6923597535349373,0.2445808003471837,207.0,0.7007017853377565,85.0,0.1822286341777836,52.0,0.4151877953045203,103.0,0.5264616349910809,21.0,0.0491058347464848,78.0,2.173414791502144,3.0
https://alonhadat.com.vn/sieu-vi-tri-ban-2mt-hoang-viet-ut-tich-p-4-tan-binh-dt-11mx21m-cn-165m2-68-ty-14092561.html,Siêu Vị Trí! Bán 2MT Hoàng Việt - Út Tịch P.4 tân Bình - DT: 11mx21m. CN: 165m2 -  68 Tỷ,2026-06-10,đường hoàng việt,"Đường Hoàng Việt, Phường 4, Quận Tân Bình, Hồ Chí Minh (cũ)",phường tân sơn nhất,hồ chí minh,14092561,unknown,can_ban,nha_mat_tien,giay_to_hop_le,6.0,15.0,18.0,10.5,21.0,68000000000.0,166.0,0,0,0,0,0,"3,19",26.533,10.3700377,107.0797927,"đường hoàng việt, hồ chí minh, Vietnam",61.19485077848705,0.4262233537407227,33.0,0.4083245356097837,3.0,0.4151620614397914,9.0,0.5168099212123147,20.0,0.5778069926084889,3.0,0.0,21.0,5.0,0.0
https://alonhadat.com.vn/can-ban-gap-mt-tran-quang-khai-p-tan-dinh-q-1-dt-6x23m-5-lau-hdt-150tr-th-48-ty-13276984.html,"Cần bán gấp MT Trần Quang Khải, P.Tân Định Q.1 - DT: 6x23m, 5 lầu, HĐT: 150tr/th - 48 tỷ",2026-06-10,đường trần quang khải,"Đường Trần Quang Khải, Phường Tân Định, Quận 1, Hồ Chí Minh (cũ)",phường tân định,hồ chí minh,13276984,unknown,can_ban,nha_mat_tien,giay_to_hop_le,5.0,15.0,8.0,6.0,23.0,48000000000.0,138.0,0,0,0,0,0,"1,23",39.45,10.7918897,106.689508,"đường trần quang khải, phường tân định, hồ chí minh, Vietnam",2.0739872715422014,0.2137503907451038,145.0,0.1868729476283893,77.0,0.2279879293529763,27.0,0.0804963877683513,98.0,1.533984909121416,13.0,0.0884775372432746,41.0,2.291945969640861,6.0
https://alonhadat.com.vn/ban-2mt-nguyen-trong-tuyen-p1-tan-binh-12x33m-nh-20m-3-tang-hdt-230-trieu-120-ty-13277046.html,"Bán 2MT Nguyễn Trọng Tuyển P1 Tân Bình -12x33m, NH:20m - 3 tầng - HĐT 230 triệu - 120 tỷ",2026-06-10,đường nguyễn trọng tuyển,"Đường Nguyễn Trọng Tuyển, Phường 1, Quận Tân Bình, Hồ Chí Minh (cũ)",phường tân sơn hòa,hồ chí minh,13277046,unknown,can_ban,nha_mat_tien,giay_to_hop_le,3.0,8.0,10.0,12.0,30.0,120000000000.0,456.0,0,0,0,0,0,"2,62",24.485,10.7981139,106.663789,"đường nguyễn trọng tuyển, phường tân sơn hòa, hồ chí minh, Vietnam",4.688161391958476,0.0907983374811933,136.0,0.4511852416410411,73.0,0.3881982979349555,21.0,0.3515334364721785,34.0,1.1921763448724754,4.0,0.0943180286140365,35.0,4.78878084818212,2.0
https://alonhadat.com.vn/ban-mat-tien-khanh-hoi-p6-q-4-dt-8-5mx20m-dtcn-170m2-3-lau-gia-48-5-ty-booc-13277677.html,"Bán mặt tiền Khánh Hội P6, Q.4, DT:  (8.5mx20m)DTCN : 170m2 .  3 lầu. giá  : 48.5 tỷ bớộc",2026-06-10,đường khánh hội,"Đường Khánh Hội, Phường 6, Quận 4, Hồ Chí Minh (cũ)",phường khánh hội,hồ chí minh,13277677,unknown,can_ban,nha_mat_tien,unknown,3.0,6.0,30.0,8.5,20.0,48500000000.0,170.0,0,0,0,0,0,"1,07",88.324,10.7565786,106.7009486,"đường khánh hội, phường khánh hội, hồ chí minh, Vietnam",2.2478180384401023,0.2699638617260751,113.0,0.3856523548268509,77.0,0.6094185733674099,34.0,0.4033713725428156,76.0,0.8585303589832586,19.0,0.0231457426463839,63.0,1.6244991335108685,4.0
https://alonhadat.com.vn/ban-gap-nha-mt-noi-bo-ly-thuong-kiet-p-14-q-10-dt-12mx16m-4-tang-gia-60-ty-tl-13290846.html,Bán gấp nhà MT nội bộ Lý Thường Kiệt P.14 Q.10 - DT: 12mx16m - 4 tầng - giá: 60 tỷ TL,2026-06-10,đường lý thường kiệt,"Đường Lý Thường Kiệt, Phường 14, Quận 10, Hồ Chí Minh (cũ)",phường diên hồng,hồ chí minh,13290846,unknown,can_ban,nha_mat_tien,giay_to_hop_le,4.0,12.0,8.0,12.0,16.0,60000000000.0,192.0,0,0,0,0,0,"1,86",40.663,10.771122,106.6598834,"Đường Lý Thường Kiệt, Phường 14, Quận 10, Hồ Chí Minh, Vietnam",4.531283386237624,0.4915090108918901,221.0,0.04520512896411,80.0,0.5461652163462242,56.0,0.4477784503636581,54.0,1.060407034128796,8.0,0.0812686656355967,53.0,4.156099753179249,2.0
https://alonhadat.com.vn/ban-nha-mt-vinh-vien-p-4-q10-cn-170m2-8mx21m-nh-9-5m-gpxd-ham-7-lau-43-ty-13291053.html,"Bán nhà MT Vĩnh Viễn, P.4, Q10 - CN: 170m2 (8mx21m, NH: 9.5m) - GPXD: Hầm 7 lầu -  43 tỷ",2026-06-10,đường vĩnh viễn,"Đường Vĩnh Viễn, Phường 4, Quận 10, Hồ Chí Minh (cũ)",phường vườn lài,hồ chí minh,13291053,unknown,can_ban,nha_mat_tien,giay_to_hop_le,1.0,2.0,8.0,8.0,21.0,43000000000.0,172.0,0,0,0,0,0,"1,28",81.309,10.7644044,106.6715417,"đường vĩnh viễn, phường vườn lài, hồ chí minh, Vietnam",3.4958007467325736,0.0646471120891191,214.0,0.242132142536861,85.0,0.1992021349057816,53.0,0.4779627153125012,82.0,0.7160332585778401,12.0,0.124942588735624,87.0,2.97055744126718,3.0
https://alonhadat.com.vn/can-ban-gap-toa-nha-2-mt-ngay-cmt8-p10-q3-12x10-m-ham-6-tang-65-ty-ve-gia-46-ty-13546955.html,"Cần bán gấp tòa nhà 2 MT ngay CMT8 - P10 - Q3 (12x10)m, hầm 6 tầng 65 tỷ về giá 46 tỷ",2026-06-10,đường rạch bùng binh,"Đường Rạch Bùng Binh, Phường 10, Quận 3, Hồ Chí Minh (cũ)",phường nhiêu lộc,hồ chí minh,13546955,unknown,can_ban,nha_mat_tien,giay_to_hop_le,6.0,15.0,10.0,12.0,10.0,46000000000.0,95.0,0,0,0,0,0,"1,71",51.515,10.7857564,106.6751204,"phường nhiêu lộc, hồ chí minh, Vietnam",2.9847876645976847,0.2172206277002377,196.0,0.5496201087659982,86.0,0.5212756588833494,39.0,0.0851074392933488,84.0,1.2196991444370473,8.0,0.3633523318916373,39.0,2.980009421216706,4.0
https://alonhadat.com.vn/can-ban-gap-mt-nguyen-thai-son-quan-go-vap-dt-24mx20m-gpxd-ham-8-tang-gia-140-ty-13555445.html,Cần bán gấp MT Nguyễn Thái Sơn Quận Gò Vấp - DT: 24mx20m - GPXD Hầm 8 tầng - Giá 140 tỷ,2026-06-10,đường nguyễn thái sơn,"Đường Nguyễn Thái Sơn, Phường 3, Quận Gò Vấp, Hồ Chí Minh (cũ)",phường hạnh thông,hồ chí minh,13555445,unknown,can_ban,nha_mat_tien,giay_to_hop_le,1.0,3.0,9.0,24.0,42.0,140000000000.0,1008.0,0,0,0,0,0,"3,37",38.239,10.820406,106.6840157,"đường nguyễn thái sơn, phường hạnh thông, hồ chí minh, Vietnam",5.15442807966281,0.2494847903364127,74.0,0.4132828544014281,33.0,0.4901964967254911,10.0,0.8504405383542083,26.0,0.7045242023991288,7.0,0.0480005790263471,43.0,4.371967127018114,3.0
