link,title,post_day,street,old_address,locality,region,listing_id,direction,listing_type,property_type,legal_status,num_floors,num_bedrooms,road_width_m,width_m,length_m,price_vnd,area_m2,dining_room_bin,kitchen_bin,terrace_bin,car_parking_bin,owner_listing_bin,locality_square,locality_population_density,lat,lon,matched_address,distance_to_center_km,nearest_school_km,school_count_3km,nearest_hospital_km,hospital_count_5km,nearest_marketplace_km,marketplace_count_3km,nearest_supermarket_km,supermarket_count_3km,nearest_mall_km,mall_count_3km,nearest_bus_stop_km,bus_stop_count_1km,nearest_metro_km,metro_count_5km
https://alonhadat.com.vn/mat-tien-su-van-hanh-q5-khuon-dat-vang-4m-x-27m-hdt-50-tr-thang-gia-32-ty-18684846.html,MẶT TIỀN SƯ VẠN HẠNH Q5 – KHUÔN ĐẤT VÀNG 4M X 27M – HĐT 50 TR/THÁNG – GIÁ 31 TỶ,2026-06-10,đường sư vạn hạnh,"Đường Sư Vạn Hạnh, Phường 9, Quận 5, Hồ Chí Minh (cũ)",phường an đông,hồ chí minh,18684846,unknown,can_ban,nha_mat_tien,unknown,3,3,20.0,4.0,27.0,31000000000.0,98.0,0,0,0,0,0,"1,32",61.537,10.7584265,106.6727204,"Cache: Locality: phường an đông, hồ chí minh",3.6979260432430068,0.1718438296278109,193.0,0.0808248175898799,81.0,0.0685624175584255,51.0,0.0700867890565216,70.0,0.0913558508966055,13.0,0.1041175126627032,91.0,3.0810228719302075,3.0
https://alonhadat.com.vn/-dien-tich-130m2-ket-cau-1-tret-2-lau-san-thuong-thiet-ke-dep-4pn-pk-bep-co-san-ro-18770186.html,"- Diện tích (130m2)kết cấu 1 trệt 2 lầu sân thượng, thiết kế đẹp, 4PN, PK, Bếp, có sân rộ",2026-06-10,đường tên lửa,"Đường Tên Lửa, Phường An Lạc, Quận Bình Tân, Hồ Chí Minh (cũ)",phường an lạc,hồ chí minh,18770186,unknown,can_ban,nha_mat_tien,so_hong_so_do,4,4,10.0,4.5,30.0,7000000000.0,130.0,1,1,1,1,0,"10,47",16.441,10.7381994,106.6148874,"Cache: Locality: phường an lạc, hồ chí minh",10.335862930945567,0.21306793729119605,59.0,0.2680604817088338,10.0,0.6955967318339753,17.0,0.3737173975421404,9.0,0.5936982882894825,1.0,0.07574177557514168,24.0,,0.0
https://alonhadat.com.vn/nha-moi-boc-tem-tinh-lo-10-ban-gap-b-tan-khu-phan-lo-cao-tang-dan-tri-cao-dt-ng-18259691.html,"Nhà mới bóc tem tỉnh lộ 10 - bán gấp - B.tân khu phân lô cao tầng,dân trí cao   -🔹Dt: ng",2026-06-10,đường bình trị đông,"Đường Bình Trị Đông, Phường Bình Trị Đông, Quận Bình Tân, Hồ Chí Minh (cũ)",phường bình trị đông,hồ chí minh,18259691,unknown,can_ban,nha_mat_tien,so_hong_so_do,2,2,8.0,6.0,21.0,5600000000.0,137.0,1,1,0,1,0,"7,15",23.097,10.7679017,106.6095921,"Cache: Locality: phường bình trị đông, hồ chí minh",10.035873377548295,0.1202792003391393,62.0,0.7940570555249221,15.0,0.5785627489676628,14.0,0.4205129244284443,25.0,2.799053811152463,1.0,0.0417572740637905,37.0,,0.0
https://alonhadat.com.vn/mat-tien-kd-ngay-cho-phu-lam-ngang-6-7-dai-15-1-tang-3pn-2wc-tan-hoa-dong-quan-6-18771207.html,"MẶT TIỀN KD NGAY CHỢ PHÚ LÂM - NGANG 6.7 DÀI 15 - 1 TẦNG - 3PN,2WC - TÂN HÒA ĐÔNG - QUẬN 6",2026-06-10,đường tân hòa đông,"Đường Tân Hòa Đông, Phường Phú Lâm, Quận 6, Hồ Chí Minh (cũ)",phường phú lâm,hồ chí minh,18771207,unknown,can_ban,nha_mat_tien,so_hong_so_do,1,3,16.0,67.0,15.0,12500000000.0,100.0,1,1,1,1,0,"2,00",43.757,10.7602198,106.6271775,"API: Street: đường tân hòa đông, phường phú lâm, hồ chí minh",8.271574310441702,0.18270486719162787,132.0,1.7162939810793083,45.0,0.026109254914863392,33.0,0.40716966307621927,27.0,2.5561534815193636,2.0,0.0762584042297964,35.0,,0.0
https://alonhadat.com.vn/mat-tien-kinh-doanh-sam-uat-ngay-khu-ten-lua-dt-100m-ngang-5m-4-tang-cach-aeon-m-18769907.html,MẶT TIỀN KINH DOANH SẦM UẤT - NGAY KHU TÊN LỬA - DT 100M - NGANG 5M - 4 TẦNG - CÁCH AEON M,2026-06-10,đường trần văn giàu,"Đường Trần Văn Giàu, Phường Tân Tạo, Quận Bình Tân, Hồ Chí Minh (cũ)",phường tân tạo,hồ chí minh,18769907,unknown,can_ban,nha_mat_tien,so_hong_so_do,4,5,20.0,5.0,20.0,12000000000.0,100.0,0,0,0,0,0,"14,71",7.707,10.7506536,106.5992101,"API: Street: đường trần văn giàu, phường tân tạo, hồ chí minh",11.494858275518997,0.1992087642376494,34.0,1.4550811617646788,10.0,0.953424886014431,7.0,0.2567042679378853,10.0,1.6463685745790202,1.0,0.49621644855275654,21.0,,0.0
https://alonhadat.com.vn/-dat-hxt-dt100m-5-x-20-no-hau-sat-mt-khu-ky-thuat-cao-gan-aeon-ten-lua-bt--18770510.html,🔥 ĐẤT HXT - DT100M - 5 X 20 - NỞ HẬU - SÁT MT KHU KỸ THUẬT CAO - GẦN AEON TÊN LỬA - BT -,2026-06-10,đường kinh dương vương,"Đường Kinh Dương Vương, Phường An Lạc, Quận Bình Tân, Hồ Chí Minh (cũ)",phường an lạc,hồ chí minh,18770510,unknown,can_ban,nha_mat_tien,so_hong_so_do,1,1,6.0,5.0,20.0,5500000000.0,100.0,1,1,1,1,0,"10,47",16.441,10.7381994,106.6148874,"Cache: Locality: phường an lạc, hồ chí minh",10.335862930945567,0.21306793729119605,59.0,0.2680604817088338,10.0,0.6955967318339753,17.0,0.3737173975421404,9.0,0.5936982882894825,1.0,0.07574177557514168,24.0,,0.0
https://alonhadat.com.vn/le-tan-be-quy-dat-dt-410-m2-gia-chi-nhich-30tr-m2-no-hau-cuc-dep-ngay-ho-ngoc-lam-18770745.html,LÊ TẤN BÊ - QUỸ ĐẤT DT 410 M2 - GIÁ CHỈ NHÍCH 30TR/M2 - NỞ HẬU CỰC ĐẸP - NGAY HỒ NGỌC LẪM,2026-06-10,đường hồ học lãm,"Đường Hồ Học Lãm, Phường An Lạc A, Quận Bình Tân, Hồ Chí Minh (cũ)",phường an lạc,hồ chí minh,18770745,unknown,can_ban,nha_mat_tien,so_hong_so_do,3,10,3.0,22.0,24.0,12500000000.0,400.0,1,1,1,1,0,"10,47",16.441,10.7381994,106.6148874,"Cache: Locality: phường an lạc, hồ chí minh",10.335862930945567,0.21306793729119605,59.0,0.2680604817088338,10.0,0.6955967318339753,17.0,0.3737173975421404,9.0,0.5936982882894825,1.0,0.07574177557514168,24.0,,0.0
https://alonhadat.com.vn/mat-tien-kinh-doanh-sam-uat-tan-phu-chi-hon-110tr-m2-4mx18m-5-vuong-vuc-khong-chi-9-ty-siu-18773318.html,MẶT TIỀN KINH DOANH SẦM UẤT TÂN PHÚ CHỈ HƠN 110TR/M2 4MX18M.5 VUÔNG VỨC KHÔNG CHỈ 9 TỶ SÍU,2026-06-10,đường sơn kỳ,"Đường Sơn Kỳ, Phường Sơn Kỳ, Quận Tân Phú, Hồ Chí Minh (cũ)",phường tây thạnh,hồ chí minh,18773318,unknown,can_ban,nha_mat_tien,so_hong_so_do,2,3,10.0,4.0,18.5,9000000000.0,74.0,1,1,0,1,0,"3,95",18.384,10.8130355,106.6227282,"Cache: Locality: phường tây thạnh, hồ chí minh",9.437312222337708,0.11561420024525948,79.0,1.1825672496564021,12.0,0.7911228419865303,7.0,1.042429527974456,16.0,1.4357153886046683,1.0,0.04908664443869594,28.0,,0.0
https://alonhadat.com.vn/-ban-nha-mat-tien-duong-phu-tho-hoa-vi-tri-dep-nhat-con-duong-18353240.html,"🏠 Bán Nhà mặt tiền Phú Thọ Hoà. Chuyên kinh doanh vải, đoạn đẹp nhất con đường.",2026-06-10,đường phú thọ hòa,"Đường Phú Thọ Hòa, Phường Phú Thọ Hòa, Quận Tân Phú, Hồ Chí Minh (cũ)",phường phú thọ hòa,hồ chí minh,18353240,unknown,can_ban,nha_mat_tien,so_hong_so_do,,,,7.0,21.0,50000000000.0,147.0,1,1,0,0,1,"3,02",46.502,10.7816272,106.6325645,"Cache: Locality: phường phú thọ hòa, hồ chí minh",7.491990724545586,0.5437001786480844,138.0,1.043868170816649,45.0,0.7408236185827164,27.0,0.4174937262587679,30.0,2.7826861671501675,1.0,0.26779996098851994,43.0,,0.0
https://alonhadat.com.vn/ngay-mat-tien-duong-duong-cong-khi-ba-diem-hoc-mon-2-tang-5x20-100m-gap-ban-gia-chi-2-55t-18773199.html,"NGAY MẶT TIỀN ĐƯỜNG DƯƠNG CÔNG KHI BÀ ĐIỂM HÓC MÔN 2 TẦNG 5X20 100M² GẤP BÁN GIÁ CHỈ 2,55T",2026-06-10,đường dương công khi,"Đường Dương Công Khi, Xã Bà Điểm, Huyện Hóc Môn, Hồ Chí Minh (cũ)",xã bà điểm,hồ chí minh,18773199,unknown,can_ban,nha_mat_tien,so_hong_so_do,2,3,10.0,5.0,20.0,2550000000.0,100.0,1,1,1,1,0,"27,36",7.026,10.8573854,106.5632931,"API: Street: đường dương công khi, xã bà điểm, hồ chí minh",17.484247112943752,0.8222380702597283,7.0,4.277708182482108,1.0,0.9252892175681081,2.0,2.706305765454217,1.0,,0.0,0.208705246554889,16.0,,0.0
https://alonhadat.com.vn/ban-lo-dat-230m2-ho-vang-tang-tan-phu-trung-gia-chi-1ty590-so-hong-rieng-18772291.html,"Bán lô đất 230m2 Hồ Văng Tắng, Tân Phú Trung giá chỉ 1tỷ590 Sổ Hồng riêng",2026-06-10,đường hồ văn tắng,"Đường Hồ Văn Tắng, Xã Tân Phú Trung, Huyện Củ Chi, Hồ Chí Minh (cũ)",xã củ chi,hồ chí minh,18772291,unknown,can_ban,nha_mat_tien,so_hong_so_do,,2,12.0,,,1590000000.0,230.0,0,0,0,0,0,"64,87",1.983,10.9707378,106.4860235,"Cache: Locality: xã củ chi, hồ chí minh",31.8065234989087,0.4626141331778094,2.0,1.1249653160266009,1.0,0.4292908923255694,2.0,1.005708735461651,2.0,,0.0,0.2482714281583424,17.0,,0.0
https://alonhadat.com.vn/lam-an-thua-lo-em-can-ban-nha-nguyen-thi-ni-tan-an-hoi-120m2-gia-1ty280-18771830.html,"Làm ăn thua lỗ em cần bán nhà Nguyễn Thị Ni, Tân An Hôi 120m2 giá 1tỷ280",2026-06-10,đường nguyễn thị nị,"Đường Nguyễn Thị Nị, Xã Tân An Hội, Huyện Củ Chi, Hồ Chí Minh (cũ)",xã tân an hội,hồ chí minh,18771830,unknown,can_ban,nha_mat_tien,unknown,,2,12.0,,,1280000000.0,120.0,0,0,0,0,0,"53,50",1.576,10.9702851,106.4651356,"API: Locality: xã tân an hội, hồ chí minh",33.496747770283704,2.7373241102562926,1.0,1.4150493879169872,1.0,1.863178699265256,1.0,1.4040968571759338,1.0,,0.0,0.9688657072195624,2.0,,0.0
https://alonhadat.com.vn/hang-hiem-phu-nhuan-sieu-pham-goc-2-mat-tien-nguyen-trong-tuyen-khong-lo-gioi-chi-33-ty-18773139.html,"HÀNG HIẾM PHÚ NHUẬN:Siêu phẩm góc 2 mặt tiền Nguyễn Trọng Tuyển, không lộ giới - Chỉ 33 Tỷ",2026-06-10,đường nguyễn trọng tuyển,"Đường Nguyễn Trọng Tuyển, Phường 10, Quận Phú Nhuận, Hồ Chí Minh (cũ)",phường phú nhuận,hồ chí minh,18773139,unknown,can_ban,nha_mat_tien,unknown,4,6,10.0,,,33000000000.0,66.0,0,0,0,0,0,"1,46",46.863,10.7978431,106.674643,"Cache: Address: đường nguyễn trọng tuyển, phường 10, quận phú nhuận, hồ chí minh",3.6895318354353357,0.4288570629001585,154.0,0.3118117616331108,76.0,0.5711071626172188,19.0,0.2563639381331828,53.0,1.9454943767766408,6.0,0.1553122603368634,47.0,3.900284792001561,4.0
https://alonhadat.com.vn/25-ty-so-huu-mat-tien-ngang-11m-duy-nhat-khu-san-bay-tan-son-nhat-tan-binh-5-lau-18773052.html,"25 tỷ sở hữu mặt tiền ngang 11m duy nhất khu sân bay Tân Sơn Nhất, Tân Bình, 5 lầu",2026-06-10,đường thăng long,"Đường Thăng Long, Phường 2, Quận Tân Bình, Hồ Chí Minh (cũ)",phường tân sơn hòa,hồ chí minh,18773052,unknown,can_ban,nha_mat_tien,unknown,5,8,10.0,11.0,25.0,25000000000.0,130.0,1,1,1,1,0,"2,62",24.485,10.7971454,106.6646052,"Cache: Locality: phường tân sơn hòa, hồ chí minh",4.557522107814423,0.121901450034046,142.0,0.372705061912835,75.0,0.3350057555399626,22.0,0.3298346011531585,36.0,1.3075347650339313,6.0,0.0442449261389241,36.0,4.652140728918879,2.0
https://alonhadat.com.vn/can-ban-gap-nha-mt-tran-huy-lieu-nguyen-van-troi-phu-nhuan-san-dong-tien-85tr-thang-18467441.html,"CẦN BÁN GẤP NHÀ MT TRẦN HUY LIỆU NGUYỄN VĂN TRỖI, PHÚ NHUẬN - SẴN DÒNG TIỀN 85TR/THÁNG",2026-06-10,đường trần huy liệu,"Đường Trần Huy Liệu, Phường Cầu Kiệu, Quận Phú Nhuận, Hồ Chí Minh (cũ)",phường cầu kiệu,hồ chí minh,18467441,unknown,can_ban,nha_mat_tien,so_hong_so_do,8,14,20.0,4.6,19.0,26500000000.0,72.0,1,1,1,1,0,"1,23",50.946,10.7968306,106.6913229,"Cache: Locality: phường cầu kiệu, hồ chí minh",2.44074910241188,0.0989473603816921,142.0,0.6077150908310768,62.0,0.6173297645718273,20.0,0.3290326866051206,74.0,2.0832634559367755,11.0,0.5346105379488431,35.0,2.4962462509231447,6.0
https://alonhadat.com.vn/mat-tien-duong-calmette-phuong-nguyen-thai-binh-quan-1-8-1x18-4-6-tang-140-ty-16964727.html,"mặt tiền đường Calmette, Phường Nguyễn Thái Bình, Quận 1 8.1x18.4 6 tầng 140 tỷ",2026-06-10,đường calmette,"Đường Calmette, Phường Nguyễn Thái Bình, Quận 1, Hồ Chí Minh (cũ)",phường sài gòn,hồ chí minh,16964727,unknown,can_ban,nha_mat_tien,so_hong_so_do,6,20,30.0,8.1,18.4,140000000000.0,721.0,1,1,1,1,0,"3,04",15.468,10.7803088,106.7054885,"Cache: Locality: phường sài gòn, hồ chí minh",0.6277042037044096,0.4752517013792162,114.0,0.3183914802084917,68.0,0.915369003541698,22.0,0.3312733645976148,97.0,0.690744449731313,15.0,0.0895344751277696,68.0,0.3523202858879943,7.0
https://alonhadat.com.vn/ban-nha-mat-tien-ly-thuong-kiet-quan-10-122m-7-tang-hd-thue-120tr-thang-18384367.html,"Bán nhà mặt tiền Lý Thường Kiệt, Quận 10 - 122m² -7 tầng - HĐ thuê 120tr/tháng",2026-06-10,đường lý thường kiệt,"Đường Lý Thường Kiệt, Phường Diên Hồng, Quận 10, Hồ Chí Minh (cũ)",phường diên hồng,hồ chí minh,18384367,tay,can_ban,nha_mat_tien,so_hong_so_do,6,10,30.0,6.0,23.0,55000000000.0,122.0,1,1,1,1,0,"1,86",40.663,10.7673031,106.6639559,"Cache: Locality: phường diên hồng, hồ chí minh",4.177717404417766,0.1321456498930087,217.0,0.6222421286803709,83.0,0.0770050538488039,55.0,0.1406451216433702,58.0,0.7120967895816094,8.0,0.1383351558074551,65.0,3.732512409760755,3.0
https://alonhadat.com.vn/tn-130-trieu-thang-234tr-m2-ban-toa-chdv-khu-duong-hoa-4-65m-x-22m-nh-6m-18772963.html,"TN 130 triệu/tháng - 234tr/m2! Bán tòa CHDV Khu Đường Hoa- 4,65m x 22m, NH 6m",2026-06-10,đường cù lao,"Đường Cù Lao, Phường 2, Quận Phú Nhuận, Hồ Chí Minh (cũ)",phường cầu kiệu,hồ chí minh,18772963,unknown,can_ban,nha_mat_tien,so_hong_so_do,5,11,4.5,4.65,22.0,31000000000.0,132.0,1,1,1,1,0,"1,23",50.946,10.7968306,106.6913229,"Cache: Locality: phường cầu kiệu, hồ chí minh",2.44074910241188,0.0989473603816921,142.0,0.6077150908310768,62.0,0.6173297645718273,20.0,0.3290326866051206,74.0,2.0832634559367755,11.0,0.5346105379488431,35.0,2.4962462509231447,6.0
https://alonhadat.com.vn/ban-chdv-5-tang-hem-o-to-duong-vo-van-ngan-linh-chieu-166-9m2-thu-nhap-145tr-thang-18772010.html,"BÁN CHDV 5 TẦNG HẺM Ô TÔ ĐƯỜNG VÕ VĂN NGÂN, LINH CHIỂU, 166.9M2, THU NHẬP 145TR/ THÁNG",2026-06-10,đường võ văn ngân,"Đường Võ Văn Ngân, Phường Linh Chiểu, Thành phố Thủ Đức, Hồ Chí Minh (cũ)",phường thủ đức,hồ chí minh,18772010,unknown,can_ban,nha_mat_tien,so_hong_so_do,5,27,4.0,10.0,16.0,18000000000.0,166.0,0,0,0,0,0,"8,81",13.502,10.8496978,106.7691507,"API: Street: đường võ văn ngân, phường thủ đức, hồ chí minh",10.979377224808673,0.16846193721712938,62.0,0.7378521818604351,11.0,0.3919621978075944,8.0,0.5705335178662765,13.0,0.43687547556564127,2.0,0.006345508100497988,71.0,0.4553921763457152,6.0
https://alonhadat.com.vn/ban-toa-nha-8-tang-goc-2mt-nguyen-van-dau-binh-thanh-9x18m-thue-130-trieu-chi-52-ty-18771972.html,"Bán Toà Nhà 8 Tầng Góc 2MT NGUYỄN VĂN ĐẬU,Bình Thạnh, 9x18m,Thuê 130 triệu,Chỉ 52 Tỷ",2026-06-10,đường nguyễn văn đậu,"Đường Nguyễn Văn Đậu, Phường 5, Quận Bình Thạnh, Hồ Chí Minh (cũ)",phường bình lợi trung,hồ chí minh,18771972,unknown,can_ban,nha_mat_tien,so_hong_so_do,8,7,20.0,9.0,18.0,45000000000.0,162.0,0,0,0,0,0,"3,89",29.851,10.8143593,106.6949846,"Cache: Locality: phường bình lợi trung, hồ chí minh",4.193692198045986,0.2964289749244463,89.0,1.0201470766061114,36.0,0.3530005832131173,14.0,0.2431588066858871,36.0,2.033952162050202,5.0,0.1253517781441358,48.0,3.0225326888196205,6.0
https://alonhadat.com.vn/sieu-pham-mt-kinh-doanh-khu-bau-cat-q-tan-binh-ngang-6-8m-hiem-tn-85tr-thang-chi-22-5-ty-18769583.html,"Siêu phẩm MT kinh doanh-Khu Bàu Cát, Q.Tân Bình ngang 6.8m hiếm-TN 85tr/tháng,chỉ 22.5 tỷ",2026-06-10,đường bàu cát,"Đường Bàu Cát, Phường 14, Quận Tân Bình, Hồ Chí Minh (cũ)",phường tân bình,hồ chí minh,18769583,unknown,can_ban,nha_mat_tien,unknown,5,12,10.0,6.8,18.0,22500000000.0,120.0,0,0,0,0,0,"2,12",42.157,10.7878255,106.6438598,"Cache: Address: đường bàu cát, phường 14, quận tân bình, hồ chí minh",6.35429173474454,0.1750195304360008,153.0,0.5225105240070275,61.0,0.45950139405485,28.0,0.4906634202464263,27.0,1.753596535716645,2.0,0.0941272756655079,48.0,,0.0
https://alonhadat.com.vn/ban-nha-mat-tien-gan-nguyen-son-tan-phu-52m2-5-2x10m-gia-5-99-ty-18772672.html,"Bán nhà Mặt Tiền Gần Nguyễn Sơn Tân Phú 52m2 5.2x10m giá 5,99 Tỷ",2026-06-10,đường nguyễn sơn,"Đường Nguyễn Sơn, Phường Phú Thọ Hòa, Quận Tân Phú, Hồ Chí Minh (cũ)",phường phú thọ hòa,hồ chí minh,18772672,unknown,can_ban,nha_mat_tien,unknown,1,3,8.0,,,5990000000.0,52.0,1,1,0,1,0,"3,02",46.502,10.7816272,106.6325645,"Cache: Address: đường nguyễn sơn, phường phú thọ hòa, quận tân phú, hồ chí minh",7.491990724545586,0.5437001786480844,138.0,1.043868170816649,45.0,0.7408236185827164,27.0,0.4174937262587679,30.0,2.7826861671501675,1.0,0.26779996098851994,43.0,,0.0
https://alonhadat.com.vn/re-nhat-san-bay-ban-nha-mat-tien-yen-the-p-2-tan-binh-dt-4-5m-x-22m-3-tang-22-9-ty-18441228.html,"Rẻ nhất sân bay! Bán nhà mặt tiền Yên Thế, P.2, Tân Bình, DT: 4.5m x 22m, 3 tầng, 22.9 tỷ",2026-06-10,đường yên thế,"Đường Yên Thế, Phường 2, Quận Tân Bình, Hồ Chí Minh (cũ)",phường tân sơn hòa,hồ chí minh,18441228,unknown,can_ban,nha_mat_tien,unknown,3,5,12.0,4.5,22.0,23000000000.0,100.0,0,0,0,0,0,"2,62",24.485,10.7971454,106.6646052,"Cache: Locality: phường tân sơn hòa, hồ chí minh",4.557522107814423,0.121901450034046,142.0,0.372705061912835,75.0,0.3350057555399626,22.0,0.3298346011531585,36.0,1.3075347650339313,6.0,0.0442449261389241,36.0,4.652140728918879,2.0
https://alonhadat.com.vn/nha-1-tret-1-lau-80m2-tai-ly-thuong-kiet-so-hong-rieng-gia-1-95-ty-18772349.html,"Nhà 1 trệt 1 lầu 80m2 tại Lý Thường Kiệt, sổ hồng riêng, giá 1,95 tỷ",2026-06-10,đường lý thường kiệt,"Đường Lý Thường Kiệt, Xã Tân Hiệp, Huyện Hóc Môn, Hồ Chí Minh (cũ)",xã hóc môn,hồ chí minh,18772349,unknown,can_ban,nha_mat_tien,so_hong_so_do,1,2,8.0,5.0,16.0,1950000000.0,80.0,0,0,0,0,0,"16,43",5.395,10.8845036,106.5880519,"API: Street: đường lý thường kiệt, xã hóc môn, hồ chí minh",17.144675241725427,0.4568402027973647,22.0,0.573431946493767,1.0,1.0233819988684911,4.0,0.7023714558762045,5.0,,0.0,0.04716867408989236,26.0,,0.0
https://alonhadat.com.vn/nha-82m2-5x16-le-thi-lo-1-8-ty-so-hong-rieng-18772284.html,"Nhà 82m2 5x16 Lê Thị Lơ, 1,8  tỷ, SỔ HỒNG RIÊNG",2026-06-10,đường lê thị lơ,"Đường Lê Thị Lơ, Xã Tân Hiệp, Huyện Hóc Môn, Hồ Chí Minh (cũ)",xã hóc môn,hồ chí minh,18772284,unknown,can_ban,nha_mat_tien,so_hong_so_do,1,2,8.0,5.0,16.0,1800000000.0,82.0,0,0,0,0,0,"16,43",5.395,10.8991617,106.5931949,"API: Street: đường lê thị lơ, xã hóc môn, hồ chí minh",17.933089792790295,0.5836166799941199,17.0,1.8297569807128418,2.0,1.1829747149163292,3.0,0.8103087192350746,5.0,,0.0,0.6835739247574167,12.0,,0.0
https://alonhadat.com.vn/that-100-mat-tien-etown-cong-hoa-tan-binh-dt-20x32m-cn-600m2-5-tang-113-ty-18386569.html,"Thật 100% Mặt tiền Etown Cộng Hòa, Tân Bình- DT 20x32m CN 600m2- 5 Tầng- 113 tỷ",2026-06-10,đường cộng hòa,"Đường Cộng Hòa, Phường 13, Quận Tân Bình, Hồ Chí Minh (cũ)",phường tân bình,hồ chí minh,18386569,unknown,can_ban,nha_mat_tien,unknown,5,5,12.0,20.0,32.0,113000000000.0,600.0,0,0,0,0,0,"2,12",42.157,11.0727938,106.6998522,"Cache: Address: đường cộng hòa, phường 13, quận tân bình, hồ chí minh",32.730247992488756,0.4800900072813918,5.0,4.4845363613594165,2.0,0.941972746731735,2.0,,0.0,3.8181403719301046,0.0,0.8441691967817977,4.0,,0.0
https://alonhadat.com.vn/ban-nha-trung-tam-phu-nhuan-dien-tich-chuan-4x16m-co-ham-rieng-gia-25-ty-18772137.html,BÁN NHÀ TRUNG TÂM PHÚ NHUẬN – DIỆN TÍCH CHUẨN 4x16M – CÓ HẦM RIÊNG – GIÁ 25 TỶ,2026-06-10,đường phan xích long,"Đường Phan Xích Long, Phường 2, Quận Phú Nhuận, Hồ Chí Minh (cũ)",phường cầu kiệu,hồ chí minh,18772137,unknown,can_ban,nha_mat_tien,unknown,4,6,10.0,,,25000000000.0,64.0,0,0,0,0,0,"1,23",50.946,10.7968306,106.6913229,"Cache: Locality: phường cầu kiệu, hồ chí minh",2.44074910241188,0.0989473603816921,142.0,0.6077150908310768,62.0,0.6173297645718273,20.0,0.3290326866051206,74.0,2.0832634559367755,11.0,0.5346105379488431,35.0,2.4962462509231447,6.0
https://alonhadat.com.vn/ban-nha-mt-truong-phuoc-phan-5-x-16m-cap-4-gia-8-2-ty-kd-sam-uat--18575549.html,"Bán nhà MT Trương Phước Phan, 5 x 16m, cấp 4, giá 8.2 tỷ. (KD sầm uất)",2026-06-10,đường trương phước phan,"Đường Trương Phước Phan, Phường Bình Trị Đông, Quận Bình Tân, Hồ Chí Minh (cũ)",phường bình trị đông,hồ chí minh,18575549,unknown,can_ban,nha_mat_tien,so_hong_so_do,1,1,16.0,5.0,16.5,8199999999.999999,82.0,0,0,0,0,0,"7,15",23.097,10.7679017,106.6095921,"Cache: Locality: phường bình trị đông, hồ chí minh",10.035873377548295,0.1202792003391393,62.0,0.7940570555249221,15.0,0.5785627489676628,14.0,0.4205129244284443,25.0,2.799053811152463,1.0,0.0417572740637905,37.0,,0.0
https://alonhadat.com.vn/ban-nha-khu-ten-lua-mt-duong-so-26-dt-6-x-20m-3-5-tam-15-3-ty-gan-aeon-mall-18721910.html,"BÁN NHÀ KHU TÊN LỬA, MT ĐƯỜNG SỐ 26, DT 6 X 20M, 3.5 TẤM, 15.3 TỶ. GẦN AEON MALL",2026-06-10,đường tên lửa,"Đường Tên Lửa, Phường Bình Trị Đông B, Quận Bình Tân, Hồ Chí Minh (cũ)",phường an lạc,hồ chí minh,18721910,unknown,can_ban,nha_mat_tien,so_hong_so_do,3,5,16.0,6.0,20.0,15300000000.0,120.0,0,0,0,0,0,"10,47",16.441,10.7381994,106.6148874,"Cache: Locality: phường an lạc, hồ chí minh",10.335862930945567,0.21306793729119605,59.0,0.2680604817088338,10.0,0.6955967318339753,17.0,0.3737173975421404,9.0,0.5936982882894825,1.0,0.07574177557514168,24.0,,0.0
https://alonhadat.com.vn/ban-nha-mat-tien-hoa-lan-phu-nhuan-gia-cuc-tot-18764699.html,"BÁN NHÀ MẶT TIỀN HOA LAN, PHÚ NHUẬN – GIÁ CỰC TỐT",2026-06-10,đường hoa lan,"Đường Hoa Lan, Phường 2, Quận Phú Nhuận, Hồ Chí Minh (cũ)",phường cầu kiệu,hồ chí minh,18764699,bac,can_ban,nha_mat_tien,unknown,4,5,15.0,4.0,18.0,23000000000.0,72.0,1,1,1,1,0,"1,23",50.946,10.7968306,106.6913229,"Cache: Address: đường hoa lan, phường 2, quận phú nhuận, hồ chí minh",2.44074910241188,0.0989473603816921,142.0,0.6077150908310768,62.0,0.6173297645718273,20.0,0.3290326866051206,74.0,2.0832634559367755,11.0,0.5346105379488431,35.0,2.4962462509231447,6.0
https://alonhadat.com.vn/sieu-pham-hang-kin-toa-nha-goc-2-mt-nguyen-van-dau-10x19m-ham-7l-hd-135-tr-chi-55-ty-18717705.html,Siêu Phẩm Hàng Kín - Tòa Nhà Góc 2 MT Hoàng Hoa Thám 10x19m Hầm 7L HĐ 135 Tr Chỉ 48 Tỷ,2026-06-10,đường nguyễn văn đậu,"Đường Nguyễn Văn Đậu, Phường 7, Quận Bình Thạnh, Hồ Chí Minh (cũ)",phường gia định,hồ chí minh,18717705,unknown,can_ban,nha_mat_tien,unknown,8,15,25.0,10.0,19.0,48000000000.0,185.0,0,0,0,0,0,"2,76",45.633,10.7947837,106.7093255,"Cache: Locality: phường gia định, hồ chí minh",2.1822596604592133,0.1711869088091718,99.0,1.4231773041651654,47.0,0.3601758043190207,17.0,0.3160654149244814,56.0,2.343508123557825,12.0,0.0265506988051478,43.0,0.6903391017798891,7.0
https://alonhadat.com.vn/nha-moi-dep-4x10-le-van-quoi-gia-4-83-ti-18620278.html,"Nhà ĐẸP 1 trệt 1 lầu Lê Văn Quới ngay BỐN XÃ - Giá 5,2 tỉ",2026-06-10,đường lê văn quới,"Đường Lê Văn Quới, Phường Bình Hưng Hòa A, Quận Bình Tân, Hồ Chí Minh (cũ)",phường bình hưng hòa,hồ chí minh,18620278,unknown,can_ban,nha_mat_tien,so_hong_so_do,2,2,5.0,4.0,11.0,5200000000.0,44.0,1,1,0,0,0,"8,47",22.190,10.7979027,106.6032118,"API: Locality: phường bình hưng hòa, hồ chí minh",10.933352980757276,0.48565831815407806,54.0,0.7107823384489044,8.0,2.295032649530436,5.0,1.4074912071012553,11.0,1.5428753503668942,1.0,0.6283008385963313,8.0,,0.0
https://alonhadat.com.vn/ban-nha-mt-cao-duc-lan-p-an-phu-tp-thu-duc-dt-8x20m-ham-4-tang-st-75tr-th-gia-47-5-ty-17559607.html,"Bán Nhà MT Cao Đức Lân P.An Phú TP.Thủ Đức, DT 8x20m, Hầm 4 Tầng ST, 75tr/th, Giá 47.5 tỷ",2026-06-10,đường cao đức lân,"Đường Cao Đức Lân, Phường An Phú, Thành phố Thủ Đức, Hồ Chí Minh (cũ)",phường an khánh,hồ chí minh,17559607,unknown,can_ban,nha_mat_tien,unknown,5,12,20.0,8.0,20.0,47500000000.0,160.0,0,0,0,0,0,"15,33",5.021,10.7850885,106.7293654,"Cache: Locality: phường an khánh, hồ chí minh",3.242272702926816,0.4644541079433794,53.0,1.7631624559602346,30.0,0.9995120096449168,11.0,0.8095548246772732,32.0,1.6542081149097525,6.0,0.0886730542335018,24.0,1.6366304217427186,8.0
