link,title,post_day,street,old_address,locality,region,listing_id,direction,listing_type,property_type,legal_status,num_floors,num_bedrooms,road_width_m,width_m,length_m,price_vnd,area_m2,dining_room_bin,kitchen_bin,terrace_bin,car_parking_bin,owner_listing_bin,locality_square,locality_population_density,lat,lon,matched_address,distance_to_center_km,nearest_school_km,school_count_3km,nearest_hospital_km,hospital_count_5km,nearest_marketplace_km,marketplace_count_3km,nearest_supermarket_km,supermarket_count_3km,nearest_mall_km,mall_count_3km,nearest_bus_stop_km,bus_stop_count_1km,nearest_metro_km,metro_count_5km
https://alonhadat.com.vn/mat-tien-12m-thong-nhat-100m2-6-tang-thang-may-doanh-thu-100tr-thang-23-ty-nhinh-18773849.html,"Mặt Tiền 12m, Thống Nhất, 100m2, 6 Tầng,Thang Máy, Doanh Thu 100tr/ Tháng, 23 Tỷ Nhỉnh",2026-06-10,đường thống nhất,"Đường Thống Nhất, Phường An Hội Đông, Quận Gò Vấp, Hồ Chí Minh (cũ)",phường an hội đông,hồ chí minh,18773849,unknown,can_ban,nha_mat_tien,so_hong_so_do,6.0,14.0,12.0,5.0,20.0,23500000000.0,100.0,1,1,1,1,0,"3,29",34.553,10.8448312,106.6637479,"đường thống nhất, phường an hội đông, hồ chí minh, Vietnam",8.542144863362457,0.0440613294910275,50.0,1.1592105234017325,10.0,0.5842311892805774,4.0,1.2026938865654762,8.0,1.951140427992964,5.0,0.1104260112163783,37.0,5.0,0.0
https://alonhadat.com.vn/-danh-cho-dau-tu-mt-ngo-thoi-nhiem-truong-dinh-9x20m-3l-hd-130-tr-th-chi-75-ty-18773842.html,🔥Dành Cho Đầu Tư - MT Ngô Thời Nhiệm - Trương Định 9x20m 3L HĐ 130 Tr/th Chỉ 75 Tỷ,2026-06-10,đường ngô thời nhiệm,"Đường Ngô Thời Nhiệm, Phường Bàn Cờ, Quận 3, Hồ Chí Minh (cũ)",phường bàn cờ,hồ chí minh,18773842,dong,can_ban,nha_mat_tien,so_hong_so_do,3.0,3.0,20.0,9.0,20.0,75000000000.0,180.0,0,0,0,0,0,"0,99",68.299,10.7700325,106.6820112,"phường bàn cờ, hồ chí minh, Vietnam",2.201106299352912,0.0644333117773673,197.0,0.3849213583177093,86.0,0.2379889447970478,47.0,0.0058038571442635,113.0,0.1386298509754801,19.0,0.0490763949995173,77.0,1.7388740272127554,4.0
https://alonhadat.com.vn/chinh-chu-ban-gap-2-mt-44-truong-quoc-dung-q-phu-nhuan-dt-4x13m-gia-chi-23-ty-18463199.html,"CHÍNH CHỦ BÁN GẤP 2 MT 44 TRƯƠNG QUỐC DUNG, Q PHÚ NHUÂN, DT: 4X13M , GIÁ CHỈ 23 TỶ",2026-06-10,đường trương quốc dung,"Đường Trương Quốc Dung, Phường 11, Quận Phú Nhuận, Hồ Chí Minh (cũ)",phường phú nhuận,hồ chí minh,18463199,unknown,can_ban,nha_mat_tien,unknown,4.0,4.0,44.0,4.281744192888376,12.84523257866513,23000000000.0,55.0,0,0,0,0,0,"1,46",46.863,10.7947441,106.6728401,"đường trương quốc dung, phường phú nhuận, hồ chí minh, Vietnam",3.64874386295914,0.2878961783175112,165.0,0.3135440856087358,80.0,0.1771691696337695,25.0,0.1848828707573728,54.0,2.1698780565540328,7.0,0.2253499087805442,45.0,3.7985822441523314,4.0
https://alonhadat.com.vn/chinh-chu-ban-gap-nha-7-tang-nguyen-trai-quan-1-dt-9-5x18m-gia-37-ty-18461419.html,"CHÍNH CHỦ BÁN GẤP NHÀ 7 TẦNG NGUYỄN TRÃI QUẬN 1, DT:9.5X18M GIÁ 37 TỶ",2026-06-10,đường nguyễn trãi,"Đường Nguyễn Trãi, Phường Nguyễn Cư Trinh, Quận 1, Hồ Chí Minh (cũ)",phường cầu ông lãnh,hồ chí minh,18461419,unknown,can_ban,nha_mat_tien,unknown,7.0,7.0,20.0,9.128709291752768,27.386127875258307,37000000000.0,250.0,0,0,0,0,0,"1,60",49.209,10.7607239,106.6855219,"đường nguyễn trãi, phường cầu ông lãnh, hồ chí minh, Vietnam",2.4556959745761966,0.3459743034941879,179.0,0.0153283944002021,91.0,0.5085132998948451,47.0,0.339885480764521,99.0,0.5212950285564317,20.0,0.106431556512389,75.0,1.7626609538487792,3.0
https://alonhadat.com.vn/chinh-chu-xua-gio-ban-gap-nha-mt-81-ho-bieu-chanh-q-phu-nhuan-dt-7-5x19m-gia-chi-27-ty-18461498.html,"CHÍNH CHỦ XƯA GIỜ BÁN GẤP NHÀ MT 81 HỒ BIỂU CHÁNH, Q.PHÚ NHUẬN, DT:7,5X19M GIÁ CHỈ 27 TỶ",2026-06-10,đường hồ biểu chánh,"Đường Hồ Biểu Chánh, Phường 11, Quận Phú Nhuận, Hồ Chí Minh (cũ)",phường phú nhuận,hồ chí minh,18461498,unknown,can_ban,nha_mat_tien,unknown,2.0,2.0,33.0,7.745966692414834,23.2379000772445,27000000000.0,180.0,0,0,0,0,0,"1,46",46.863,10.794035,106.6770483,"đường hồ biểu chánh, phường phú nhuận, hồ chí minh, Vietnam",3.22443271667124,0.0694095480430843,168.0,0.3416504369705601,81.0,0.574598789523646,24.0,0.2112956719001877,58.0,2.0061668906688466,8.0,0.1530383602394927,46.0,3.4224638087302064,4.0
https://alonhadat.com.vn/ban-nha-mt-24-dinh-bo-linh-q-binh-thanh-dt-12x22m-7-tang-gia-125-ty-18461559.html,"BÁN NHÀ MT 24 ĐINH BÔ LĨNH , Q.BÌNH THẠNH , DT:12x22m, 7 TẦNG, GIÁ: 125 tỷ",2026-06-10,đường đinh bộ lĩnh,"Đường Đinh Bộ Lĩnh, Phường 26, Quận Bình Thạnh, Hồ Chí Minh (cũ)",phường bình thạnh,hồ chí minh,18461559,unknown,can_ban,nha_mat_tien,unknown,8.0,8.0,66.0,8.755950357709132,26.267851073127392,125000000000.0,230.0,0,0,0,0,0,"3,32",38.042,10.8087887,106.7086489,"đường đinh bộ lĩnh, phường bình thạnh, hồ chí minh, Vietnam",3.627683910805435,0.092770057368434,93.0,1.4801367756556396,38.0,1.3318686290477475,15.0,0.5009314330584822,49.0,2.5198965312788086,3.0,0.1133809924087942,45.0,1.5956976130690346,7.0
https://alonhadat.com.vn/chinh-chu-ban-gap-nha-mt-235-ly-chinh-thang-quan-1-dt-4x16m-gia-chi-27-ty-18460131.html,"CHÍNH CHỦ BÁN GẤP NHÀ MT 235 LÝ CHÍNH THẮNG, QUẬN 1, DT:4X16M, GIÁ CHỈ 27 TỶ",2026-06-10,đường lý chính thắng,"Đường Lý Chính Thắng, Phường 9, Quận 3, Hồ Chí Minh (cũ)",phường nhiêu lộc,hồ chí minh,18460131,unknown,can_ban,nha_mat_tien,unknown,3.0,3.0,30.0,5.41602560309064,16.24807680927192,27000000000.0,88.0,0,0,0,0,0,"1,71",51.515,10.7830833,106.6842416,"đường lý chính thắng, phường nhiêu lộc, hồ chí minh, Vietnam",1.9460436499848384,0.3312847310363263,191.0,0.1412704733229399,83.0,0.6006546929080936,47.0,0.5582479452345399,116.0,0.8385575755765127,18.0,0.1032637579844324,80.0,2.006868832724398,5.0
https://alonhadat.com.vn/chinh-chu-ban-gap-mt-49-phan-dang-luu-q-phu-nhuan-dt-8x20m-gia-55-ty-18468346.html,"CHÍNH CHỦ BÁN GẤP MT 49 PHAN ĐĂNG LƯU , Q.PHÚ NHUẬN, DT:8X20M, GIÁ 55 TỶ",2026-06-10,đường phan đăng lưu,"Đường Phan Đăng Lưu, Phường 1, Quận Phú Nhuận, Hồ Chí Minh (cũ)",phường cầu kiệu,hồ chí minh,18468346,unknown,can_ban,nha_mat_tien,unknown,4.0,4.0,55.0,7.637626158259733,22.9128784747792,55000000000.0,175.0,0,0,0,0,0,"1,23",50.946,10.7994686,106.6825238,"đường phan đăng lưu, phường cầu kiệu, hồ chí minh, Vietnam",3.204820154371627,0.2635712509822548,153.0,0.6525631965622177,64.0,0.4504130592990115,20.0,0.5410249684569507,60.0,2.375241010354709,5.0,0.1388857296812283,36.0,3.422538993510745,5.0
https://alonhadat.com.vn/chinh-chu-ban-gap-nha-2-mt-ton-that-tung-quan-1-dt-7x13m-gia-43-ty-18410151.html,"CHÍNH CHỦ BÁN GẤP NHÀ 2 MT TÔN THẤT TÙNG , QUẬN 1,DT:7x13M, GIÁ 43 TỶ",2026-06-10,đường tôn thất tùng,"Đường Tôn Thất Tùng, Phường Bến Thành, Quận 1, Hồ Chí Minh (cũ)",phường bến thành,hồ chí minh,18410151,unknown,can_ban,nha_mat_tien,unknown,4.0,4.0,40.0,5.477225575051661,16.431676725154983,43000000000.0,90.0,0,0,0,0,0,"1,85",38.809,10.7703806,106.6951066,"phường bến thành, hồ chí minh, Vietnam",0.9599531806807066,0.1682281419757254,156.0,0.4687869383164875,90.0,0.392590184870133,43.0,0.2254505420255021,104.0,0.540445117494645,19.0,0.1102065228684687,110.0,0.3100919595528648,5.0
https://alonhadat.com.vn/ban-nha-mt-bui-dinh-tuy-p-26-q-binh-thanh-dt-5x22m-4-tang-gia-18-5-ty-16656233.html,"BÁN NHÀ BÙI ĐÌNH TUÝ P.26 DT 5mx22m, 4 tầng, giá 14.9 tỷ Q BÌNH THẠNH",2026-06-10,đường bùi đình túy,"Đường Bùi Đình Túy, Phường 26, Quận Bình Thạnh, Hồ Chí Minh (cũ)",phường bình thạnh,hồ chí minh,16656233,unknown,can_ban,nha_mat_tien,unknown,4.0,8.0,15.0,6.055300708194984,18.16590212458495,14900000000.0,110.0,0,0,0,0,0,"3,32",38.042,10.8111809,106.7033938,"phường bình thạnh, hồ chí minh, Vietnam",3.8017162728700273,0.3183148772046095,101.0,1.079901323762298,36.0,0.8769307135301863,16.0,0.0681104411068104,46.0,2.6953239778907294,3.0,0.0255766729188187,47.0,2.1339688866851096,7.0
https://alonhadat.com.vn/no-bank-can-ban-nha-mt-hoang-hoa-tham-phuong-7-binh-thanh-dt-8x20-gia-45-ty-17935580.html,"Nợ bank cần bán nhà MT Hoàng Hoa Thám, Phường 7, Bình Thạnh. DT: 8x20 giá 45 tỷ",2026-06-10,đường hoàng hoa thám,"Đường Hoàng Hoa Thám, Phường 7, Quận Bình Thạnh, Hồ Chí Minh (cũ)",phường gia định,hồ chí minh,17935580,unknown,can_ban,nha_mat_tien,so_hong_so_do,2.0,5.0,15.0,7.187952884282608,21.563858652847824,32000000000.0,155.0,0,0,0,0,0,"2,76",45.633,10.8078013,106.6914576,"đường hoàng hoa thám, phường gia định, hồ chí minh, Vietnam",3.5706757820599533,0.430245323172635,119.0,0.4382962050094762,49.0,0.5164011136863673,15.0,0.4057033527291865,58.0,2.316537611571925,5.0,0.2215246604316377,46.0,2.9333481320658805,6.0
https://alonhadat.com.vn/ban-nha-goc-2-mat-tien-le-van-duyet-binh-thanh-6x16m-5-tang-hdt-100-trieu-18000226.html,"Bán nhà góc 2 mặt tiền Lê Văn Duyệt, Bình thạnh - 6x16m - 5 tầng - HDT: 100 triệu",2026-06-10,đường lê văn duyệt,"Đường Lê Văn Duyệt, Phường 3, Quận Bình Thạnh, Hồ Chí Minh (cũ)",phường gia định,hồ chí minh,18000226,unknown,can_ban,nha_mat_tien,so_hong_so_do,5.0,7.0,15.0,5.163977794943222,15.491933384829668,36000000000.0,80.0,0,0,0,0,0,"2,76",45.633,10.7973977,106.6953649,"đường lê văn duyệt, phường gia định, hồ chí minh, Vietnam",2.346735279356983,0.0727444103980166,130.0,0.1670651494304294,59.0,0.563671580617831,20.0,0.1789346357801568,75.0,2.2174111422781486,11.0,0.0884218511842536,38.0,2.207625374628704,6.0
https://alonhadat.com.vn/goc-2mt-phan-dang-luu-binh-thanh-16x45m-3-tang-hdt-300-trieu-gia-180-ty-17953999.html,"Góc 2MT Phan Đăng Lưu, Bình Thạnh - 16x45m - 3 tầng - HĐT 300 triệu - giá 180 tỷ",2026-06-10,đường phan đăng lưu,"Đường Phan Đăng Lưu, Phường 6, Quận Bình Thạnh, Hồ Chí Minh (cũ)",phường bình lợi trung,hồ chí minh,17953999,unknown,can_ban,nha_mat_tien,so_hong_so_do,3.0,6.0,15.0,15.491933384829668,46.475800154489,180000000000.0,720.0,0,0,0,0,0,"3,89",29.851,10.8026588,106.6957607,"đường phan đăng lưu, hồ chí minh, Vietnam",2.904170804800293,0.0691289109689762,130.0,0.1445941186951344,50.0,0.3513150197837566,16.0,0.3676143151877772,60.0,2.792844049480154,1.0,0.0232465191701605,40.0,2.2795329308265964,6.0
https://alonhadat.com.vn/ban-biet-thu-hado-centrosa-p-12-quan-10-dt-5-5-16m-kc-4-tang-gia-chi-51-ty-18769435.html,"Bán biệt thự HADO CENTROSA, P,12, Quận 10. DT: 5.5*16M, KC: 4 tầng. Giá chỉ: 51 tỷ",2026-06-10,đường 3/2,"Đường 3/2, Phường 12, Quận 10, Hồ Chí Minh (cũ)",phường hòa hưng,hồ chí minh,18769435,unknown,can_ban,nha_mat_tien,so_hong_so_do,4.0,4.0,10.0,5.5,16.0,51000000000.0,88.0,0,0,0,0,0,"2,59",37.225,10.7584681,106.6832126,"Đường 3/2, Phường 12, Quận 10, Hồ Chí Minh, Vietnam",2.810528696978863,0.2254260912054419,183.0,0.3484700437096293,87.0,0.3269002154348162,47.0,0.2939993610611568,93.0,0.6542757907602624,21.0,0.0495583751230959,72.0,2.116697545478862,3.0
https://alonhadat.com.vn/goc-2-mat-tien-pham-van-dong-go-vap-41x35m-no-hau-hd-thue-250-trieu-gia-240-ty-18773819.html,"Góc 2 mặt tiền Phạm Văn Đồng (Gò Vấp), 41x35m, nở hậu, HĐ thuê 250 triệu, giá 240 tỷ",2026-06-10,đường phạm văn đồng,"Đường Phạm Văn Đồng, Phường 1, Quận Gò Vấp, Hồ Chí Minh (cũ)",phường hạnh thông,hồ chí minh,18773819,unknown,can_ban,nha_mat_tien,giay_to_hop_le,1.0,2.0,60.0,41.0,35.0,240000000000.0,1380.0,0,0,0,0,0,"3,37",38.239,10.8183828,106.6866804,"đường phạm văn đồng, phường hạnh thông, hồ chí minh, Vietnam",4.844897245825004,0.1446252794333038,75.0,0.6418370847925045,35.0,0.5696396859678009,10.0,0.8944871952221576,31.0,1.061857611424201,7.0,0.1514562078101606,41.0,4.004567351819027,3.0
https://alonhadat.com.vn/mat-tien-hong-ha-vip-p2-10-2x21m-3-tang-gia-tl-15206400.html,"Bán Nhà Mặt Tiền Hồng Hà Phường 2 Tân Bình, Gần Sân Bay, 10.2X21M,3 TẦNG,5X TỶ",2026-06-10,đường hồng hà,"Đường Hồng Hà, Phường 2, Quận Tân Bình, Hồ Chí Minh (cũ)",phường tân sơn hòa,hồ chí minh,15206400,unknown,can_ban,nha_mat_tien,unknown,3.0,5.0,30.0,10.2,21.0,58000000000.0,220.0,1,1,1,1,0,"2,62",24.485,10.8124799,106.6646444,"đường hồng hà, phường tân sơn hòa, hồ chí minh, Vietnam",5.586613919254435,0.226956575250719,99.0,1.1281419956884975,44.0,1.8906087565304883,12.0,1.529666862039232,21.0,0.1309239741353559,9.0,0.2035749914161559,20.0,5.0,0.0
https://alonhadat.com.vn/ban-nha-mat-tien-p13-tan-binh-hoang-hoa-tham-5-5x22m-2x-ty-16244012.html,"BÁN NHÀ MẶT TIỀN P13 TÂN BÌNH,HOÀNG HOA THÁM, 5.5X22M, 2X TỶ",2026-06-10,đường hoàng hoa thám,"Đường Hoàng Hoa Thám, Phường 13, Quận Tân Bình, Hồ Chí Minh (cũ)",phường tân bình,hồ chí minh,16244012,unknown,can_ban,nha_mat_tien,unknown,3.0,4.0,20.0,5.5,22.0,29999000000.0,110.0,1,1,1,1,0,"2,12",42.157,10.7983563,106.6463241,"đường hoàng hoa thám, phường tân bình, hồ chí minh, Vietnam",6.4232480821112174,0.2630116487217966,131.0,0.546995096737269,49.0,0.0447465857250088,21.0,1.195024347818329,21.0,0.7797317274616953,4.0,0.1908999184323034,43.0,5.0,0.0
https://alonhadat.com.vn/ban-nha-mat-tien-p13-tan-binh-hoang-hoa-tham-cong-hoa-180m-2x-ty-16244132.html,"BÁN NHÀ MẶT TIỀN P13 TÂN BÌNH,HOÀNG HOA THÁM,CỘNG HÒA, 180M,2X TỶ",2026-06-10,đường hoàng hoa thám,"Đường Hoàng Hoa Thám, Phường 13, Quận Tân Bình, Hồ Chí Minh (cũ)",phường tân bình,hồ chí minh,16244132,unknown,can_ban,nha_mat_tien,unknown,2.0,3.0,20.0,5.5,32.0,29800000000.0,180.0,1,1,0,1,0,"2,12",42.157,10.7983563,106.6463241,"đường hoàng hoa thám, phường tân bình, hồ chí minh, Vietnam",6.4232480821112174,0.2630116487217966,131.0,0.546995096737269,49.0,0.0447465857250088,21.0,1.195024347818329,21.0,0.7797317274616953,4.0,0.1908999184323034,43.0,5.0,0.0
https://alonhadat.com.vn/ban-chdv-mat-tien-kinh-doanh-phuong-tan-son-nhi-tan-phu-8x16m-40-phong-thu-2-7-ty-nam-16665915.html,"Bán CHDV Mặt Tiền Kinh Doanh Phường Tân Sơn Nhì Tân Phú, 8x16m, 40 Phòng, Thu 2.7 tỷ. Năm",2026-06-10,đường tân sơn nhì,"Đường Tân Sơn Nhì, Phường Tân Sơn Nhì, Quận Tân Phú, Hồ Chí Minh (cũ)",phường tân sơn nhì,hồ chí minh,16665915,unknown,can_ban,nha_mat_tien,unknown,5.0,40.0,30.0,8.0,16.0,32499000000.000004,130.0,1,1,1,1,0,"3,46",33.895,10.7994465,106.6317527,"đường tân sơn nhì, phường tân sơn nhì, hồ chí minh, Vietnam",7.962906097890229,0.2680312245988887,89.0,1.077973098294951,24.0,0.6748268350093294,15.0,0.5342187744615536,19.0,1.642934800464962,3.0,0.4226215899315095,47.0,5.0,0.0
https://alonhadat.com.vn/ban-nha-mat-tien-thut-truong-chinh-phuong-15-tan-binh-170m-5x32m-500m-san-15-x-ty-17044650.html,"Bán Nhà Mặt Tiền Thụt, Trường Chinh Phường 15 Tân Bình, 170m, 5x34m, 500m sàn, 15.x tỷ",2026-06-10,đường trường chinh,"Đường Trường Chinh, Phường 15, Quận Tân Bình, Hồ Chí Minh (cũ)",phường tân sơn,hồ chí minh,17044650,unknown,can_ban,nha_mat_tien,unknown,5.0,6.0,6.0,5.0,34.0,15500000000.0,170.0,1,1,1,1,0,"10,12",7.631,10.8241628,106.629005,"đường trường chinh, phường tân sơn, hồ chí minh, Vietnam",9.44188587512006,0.4487809935467923,73.0,1.143972371002714,13.0,0.8493003977309863,8.0,0.192734804128349,14.0,2.844257798587869,1.0,0.1414530554975742,25.0,5.0,0.0
https://alonhadat.com.vn/mt-phan-dinh-phung-p-2-q-pn-4x17m-gia-21-8-ty-8420736.html,MT Phan Đình Phùng P.2 Q.PN 4x17m giá 21.8 tỷ,2026-06-10,đường phan đình phùng,"Đường Phan Đình Phùng, Phường 2, Quận Phú Nhuận, Hồ Chí Minh (cũ)",phường cầu kiệu,hồ chí minh,8420736,unknown,can_ban,nha_mat_tien,unknown,1.0,3.0,10.0,4.0,17.0,21800000000.0,64.0,0,0,0,0,0,"1,23",50.946,10.7951863,106.6840954,"đường phan đình phùng, phường cầu kiệu, hồ chí minh, Vietnam",2.73294969497402,0.268345803701012,156.0,0.7440297882213216,80.0,0.2040724850715341,24.0,0.3278271927366389,68.0,2.008188119285779,6.0,0.1177164242699256,39.0,2.949688319556361,5.0
https://alonhadat.com.vn/sieu-pham-mt-co-bac-p-co-giang-q-1-9x15m-vuong-vuc-gia-chi-40-ty-12856835.html,Siêu Phẩm MT Cô Bắc P.Cô Giang Q.1 9x15m vuông vức giá chỉ 40 tỷ,2026-06-10,đường cô bắc,"Đường Cô Bắc, Phường Cô Giang, Quận 1, Hồ Chí Minh (cũ)",phường cầu ông lãnh,hồ chí minh,12856835,unknown,can_ban,nha_mat_tien,unknown,1.0,4.0,30.0,9.0,15.0,40000000000.0,140.0,0,0,0,0,0,"1,60",49.209,10.7655997,106.6956449,"đường cô bắc, phường cầu ông lãnh, hồ chí minh, Vietnam",1.3757709878610516,0.0830551072958794,149.0,0.2698782458778774,87.0,0.2608905208186114,38.0,0.095657713135629,94.0,0.2947330774901529,19.0,0.1214531124824003,109.0,0.6403064813585765,5.0
https://alonhadat.com.vn/can-ban-gap-mat-tien-hat-giang-p-2-tan-binh-10-7m-x-17-5m-3-tang-gia-ban-39-ty-18773813.html,"Cần bán gấp! Mặt tiền  Hát Giang, P.2, Tân Bình, (10.7m x 17.5m), 3 tầng, giá bán 39 tỷ",2026-06-10,đường hát giang,"Đường Hát Giang, Phường 2, Quận Tân Bình, Hồ Chí Minh (cũ)",phường tân sơn hòa,hồ chí minh,18773813,unknown,can_ban,nha_mat_tien,unknown,3.0,5.0,16.0,7.52772652709081,22.583179581272432,39000000000.0,170.0,1,1,1,1,0,"2,62",24.485,10.7971454,106.6646052,"phường tân sơn hòa, hồ chí minh, Vietnam",4.557522107814423,0.121901450034046,142.0,0.372705061912835,75.0,0.3350057555399626,22.0,0.3298346011531585,36.0,1.3075347650339313,6.0,0.0442449261389241,36.0,4.652140728918879,2.0
https://alonhadat.com.vn/34-ty-ban-mat-tien-duong-nguyen-gia-tri-d2-phuong-25-quan-binh-thanh-4x21m-5-tang-18048547.html,"34 tỷ! Bán mặt tiền đường Nguyễn Gia Trí (D2), Phường 25, quận Bình Thạnh 5mx21m 5 Tầng",2026-06-10,đường nguyễn gia trí,"Đường Nguyễn Gia Trí, Phường 25, Quận Bình Thạnh, Hồ Chí Minh (cũ)",phường thạnh mỹ tây,hồ chí minh,18048547,unknown,can_ban,nha_mat_tien,so_hong_so_do,3.0,5.0,15.0,5.291502622129181,15.874507866387544,34000000000.0,84.0,0,0,0,0,0,"4,40",34.822,10.807296,106.7162533,"đường nguyễn gia trí, phường thạnh mỹ tây, hồ chí minh, Vietnam",3.758154589654936,0.1585883966124273,73.0,1.9186314336654,29.0,0.7820545881699111,13.0,0.6969131489093239,44.0,1.9691784335625064,4.0,0.0657438826006079,39.0,1.2294195016751308,9.0
https://alonhadat.com.vn/ban-nha-mt-vo-truong-toan-q-binh-thanh-dt-10mx28m-3tang-gia-39ty-17340708.html,Bán nhà MT VÕ TRƯỜNG TOẢN DT 10mx28m 4tang giá 37ty Q BÌNH THẠNH,2026-06-10,đường võ trường toản,"Đường Võ Trường Toản, Phường 2, Quận Bình Thạnh, Hồ Chí Minh (cũ)",phường gia định,hồ chí minh,17340708,unknown,can_ban,nha_mat_tien,so_hong_so_do,3.0,6.0,15.0,9.66091783079296,28.98275349237888,37000000000.0,280.0,0,0,0,0,0,"2,76",45.633,10.8022437,106.6999239,"đường võ trường toản, phường gia định, hồ chí minh, Vietnam",2.805379503662848,0.2356226421954623,118.0,0.5703302230144277,48.0,0.1360107279082033,16.0,0.2092627406073556,62.0,2.8846937836487974,1.0,0.0956520272284795,41.0,1.836397267095268,7.0
https://alonhadat.com.vn/hang-hot-mat-tien-ly-thai-to-p-1-q-10-dt-90m2-4-lau-gia-chi-23-5-ty-tl-17039379.html,HÀNG HOT–MẶT TIỀN LÝ THÁI TỔ P.1 Q.10 DT 90m2 4 LẦU GIÁ CHỈ 27.5 TỶ tl,2026-06-10,đường lý thái tổ,"Đường Lý Thái Tổ, Phường 1, Quận 10, Hồ Chí Minh (cũ)",phường vườn lài,hồ chí minh,17039379,unknown,can_ban,nha_mat_tien,so_hong_so_do,4.0,6.0,30.0,5.0,18.0,27500000000.0,90.0,0,0,0,0,0,"1,28",81.309,10.768525,106.6724938,"đường lý thái tổ, phường vườn lài, hồ chí minh, Vietnam",3.2419722128438297,0.3010820874778004,222.0,0.2811142836074399,87.0,0.2622385558569263,54.0,0.3931772678968423,92.0,0.3926340325942063,11.0,0.1032738006671135,74.0,2.789766515743807,3.0
https://alonhadat.com.vn/can-ban-nha-mat-tien-co-giang-trung-tam-q-1-dt-60m2-4-4-tang-gia-34-ty-tl-18034972.html,CẦN BÁN NHÀ MẶT TIỀN CÔ GIANG – TRUNG TÂM Q.1 DT 60m2 4 4 TẦNG GIÁ 33.5 TỶ TL,2026-06-10,đường cô giang,"Đường Cô Giang, Phường Cô Giang, Quận 1, Hồ Chí Minh (cũ)",phường cầu ông lãnh,hồ chí minh,18034972,unknown,can_ban,nha_mat_tien,so_hong_so_do,4.0,6.0,30.0,4.0,15.0,33500000000.0,60.0,0,0,0,0,0,"1,60",49.209,10.7619583,106.6941232,"đường cô giang, phường cầu ông lãnh, hồ chí minh, Vietnam",1.8113351115752057,0.096024229088835,149.0,0.2950513332403354,86.0,0.1138985119141339,37.0,0.1533970722501798,90.0,0.1080624106761167,19.0,0.1574704841190887,81.0,1.0761240654859967,4.0
https://alonhadat.com.vn/hang-moi-mat-tien-vo-van-tan-q3-4-tang-gia-45-ty-tl-18769846.html,"Hàng mới mặt tiền Võ Văn Tần , Q3 4 tầng giá 45 tỷ TL",2026-06-10,đường võ văn tần,"Đường Võ Văn Tần, Phường 5, Quận 3, Hồ Chí Minh (cũ)",phường bàn cờ,hồ chí minh,18769846,unknown,can_ban,nha_mat_tien,so_hong_so_do,4.0,6.0,30.0,4.6,18.0,45000000000.0,80.0,0,0,0,0,0,"0,99",68.299,10.7717404,106.6863799,"đường võ văn tần, phường bàn cờ, hồ chí minh, Vietnam",1.68750072773337,0.1714764211582539,181.0,0.3174114748011489,87.0,0.3043537985316076,44.0,0.2297448318308255,116.0,0.4614093998815363,18.0,0.1043281640509522,85.0,1.2611487830956705,4.0
https://alonhadat.com.vn/-hot-hang-hiem-quan-5-115m2-7-tang-thang-may-gia-37-ty-tl-18770131.html,🔥 HOT HÀNG HIẾM QUẬN 5 🔥 115m2 7 tầng thang máy giá 37 tỷ TL,2026-06-10,đường nguyễn chí thanh,"Đường Nguyễn Chí Thanh, Phường 12, Quận 5, Hồ Chí Minh (cũ)",phường chợ lớn,hồ chí minh,18770131,unknown,can_ban,nha_mat_tien,so_hong_so_do,7.0,15.0,30.0,4.2,27.0,37000000000.0,115.0,0,0,0,0,0,"1,67",50.938,10.7580895,106.6601012,"đường nguyễn chí thanh, phường chợ lớn, hồ chí minh, Vietnam",4.92351626973221,0.0906281021144673,206.0,0.0675283336786914,79.0,0.4153551389511791,53.0,0.2444007357054964,34.0,0.3992260934586275,10.0,0.0145156921149243,85.0,4.370274985813198,2.0
https://alonhadat.com.vn/hot-nhat-q5-mt-nguyen-chi-thanh-4-tang-thang-may-chi-25-ty-18754398.html,HOT NHẤT Q5 MT NGUYỄN CHÍ THANH 4 TẦNG THANG MÁY CHỈ 25 TỶ,2026-06-10,đường nguyễn chí thanh,"Đường Nguyễn Chí Thanh, Phường 9, Quận 5, Hồ Chí Minh (cũ)",phường an đông,hồ chí minh,18754398,unknown,can_ban,nha_mat_tien,so_hong_so_do,4.0,6.0,30.0,4.0,15.0,25000000000.0,60.0,0,0,0,0,0,"1,32",61.537,10.7589601,106.6672472,"đường nguyễn chí thanh, phường an đông, hồ chí minh, Vietnam",4.1815297564873335,0.0884968467722012,214.0,0.3077432393146166,81.0,0.5482279654113431,53.0,0.4727335667318857,53.0,0.5915155579923946,11.0,0.0834637220870152,89.0,3.6036041088512096,2.0
https://alonhadat.com.vn/hang-hot-mt-tran-hung-dap-q5-doan-2-chieu-dt-68m2-5-tang-gia-chi-29-ty-tl-18743562.html,Hàng Hot MT Trần Hưng Đạp Q5 Đoạn 2 Chiểu DT 68m2 5 tầng giá chỉ 29 tỷ TL,2026-06-10,đường trần hưng đạo,"Đường Trần Hưng Đạo, Phường 6, Quận 5, Hồ Chí Minh (cũ)",phường an đông,hồ chí minh,18743562,unknown,can_ban,nha_mat_tien,so_hong_so_do,5.0,8.0,30.0,4.0,17.0,29000000000.0,68.0,0,0,0,0,0,"1,32",61.537,10.7527733,106.6707128,"đường trần hưng đạo, phường an đông, hồ chí minh, Vietnam",4.245367812243005,0.1904079725029946,175.0,0.221582978565162,81.0,0.5457471409518302,47.0,0.4407044802048359,54.0,0.6284739830434839,12.0,0.0475642381740097,83.0,3.587894537183847,2.0
https://alonhadat.com.vn/ban-gap-nha-mat-tien-nguyen-tri-phuong-p-8-q10-dt-86m2-ham-6-tang-gia-41-ty-tl-18734497.html,"Bán gấp nhà mặt tiền Nguyễn Tri Phương, P.8, Q10 DT 86m2 hầm  6 tầng giá 41 tỷ TL",2026-06-10,đường nguyễn tri phương,"Đường Nguyễn Tri Phương, Phường 8, Quận 10, Hồ Chí Minh (cũ)",phường diên hồng,hồ chí minh,18734497,unknown,can_ban,nha_mat_tien,so_hong_so_do,7.0,15.0,30.0,4.0,21.0,41000000000.0,86.0,0,0,0,0,0,"1,86",40.663,10.9617258,106.6540474,"đường nguyễn tri phương, hồ chí minh, Vietnam",21.07629072122304,0.302422283165317,18.0,1.8122624629031423,4.0,1.7511389922040874,2.0,1.5182491168608223,6.0,3.668132058461778,0.0,1.0501778616210362,0.0,5.0,0.0
https://alonhadat.com.vn/ban-dat-mat-tien-dang-thuy-tram-p-13-binh-thanh-5m-x-22m-110m-mat-tien-gia-22-ty-18773793.html,"BÁN ĐẤT MẶT TIỀN ĐẶNG THÙY TRÂM, P.13, BÌNH THẠNH – 5m x 22m – 110m² – MẶT TIỀN GIÁ 22 TỶ",2026-06-10,đường đặng thuỳ trâm,"Đường Đặng Thuỳ Trâm, Phường 13, Quận Bình Thạnh, Hồ Chí Minh (cũ)",phường bình lợi trung,hồ chí minh,18773793,unknown,can_ban,nha_mat_tien,unknown,2.0,2.0,30.0,5.0,21.0,22000000000.0,110.0,0,0,0,0,0,"3,89",29.851,10.8267759,106.7019635,"đường đặng thuỳ trâm, phường bình lợi trung, hồ chí minh, Vietnam",5.518162999413561,0.3229844614613355,52.0,1.7872345276552803,23.0,0.6863846982219879,8.0,0.7441141835754278,26.0,2.1428895093998177,6.0,0.2216411070038452,25.0,3.706835542545565,4.0
