"link","title","post_day","street","old_address","locality","region","listing_id","direction","listing_type","property_type","legal_status","num_floors","num_bedrooms","road_width_m","width_m","length_m","price_vnd","area_m2","description","dining_room_bin","kitchen_bin","terrace_bin","car_parking_bin","owner_listing_bin","locality_square","locality_population_density","lat","lon","matched_address","distance_to_center_km","nearest_school_km","school_count_3km","nearest_hospital_km","hospital_count_5km","nearest_marketplace_km","marketplace_count_3km","nearest_supermarket_km","supermarket_count_3km","nearest_mall_km","mall_count_3km","nearest_bus_stop_km","bus_stop_count_1km","nearest_metro_km","metro_count_5km"
"https://alonhadat.com.vn/hxh-phu-tho-hoa-nha-3-tang-8pn-thu-nhap-35-40-trieu-thang-chi-9-ty-18869063.html","HXH - Phú Thọ Hòa – Nhà 3 Tầng 4.5 x 19m - 86m2, Thu Nhập 35–40 Triệu/Tháng – Chỉ hơn 8 Tỷ","2026-07-23","đường phú thọ hòa","Đường Phú Thọ Hòa, Phường Phú Thọ Hòa, Quận Tân Phú, Hồ Chí Minh (cũ)","phường phú thọ hòa","hồ chí minh","18869063","unknown","can_ban","nha_trong_hem","so_hong_so_do","3","8","6.0","4.5","19.0","8900000000.0","85.0","HXH - Phú Thọ Hòa – Nhà 3 Tầng 8PN, Thu Nhập 35–40 Triệu/Tháng – Chỉ hơn 8 Tỷ * Diện tích: 4.5 x 19m (85m²), nở hậu đẹp. * Kết cấu: 1 trệt 2 lầu, 8 phòng ngủ, 8 WC. * Phù hợp vừa ở vừa khai thác cho thuê, thu nhập khoảng 35–40 triệu/tháng. * Hẻm xe hơi thông thoáng, xe tải nhỏ đậu cửa. * Vị trí gần Lũy Bán Bích, chợ Phú Thọ Hòa","0","0","0","0","0","3,02","46.502","10.787491","106.6301863","Cache: Address: đường phú thọ hòa, phường phú thọ hòa, quận tân phú, hồ chí minh","7.8219717532425275","0.119801214052008","126","1.35644439613699","36","0.638465632425678","20","0.283055770479084","27","2.12082564070215","3","0.0867377739580452","48","","0"
"https://alonhadat.com.vn/-o-to-ngu-nha-le-quang-dinh-binh-thanh-gan-ba-chieu-4-tang-70m2-18915772.html","🔥 Ô tô ngủ nhà - Lê Quang Định, Bình Thạnh - Gần Bà Chiểu - 4 Tầng 70m2","2026-07-22","đường lê quang định","Đường Lê Quang Định, Phường 7, Quận Bình Thạnh, Hồ Chí Minh (cũ)","phường gia định","hồ chí minh","18915772","unknown","can_ban","nha_trong_hem","so_hong_so_do","4","4","5.0","4.2","16.0","13600000000.0","70.0","💎Cư Nhà Thật💎 Ô tô ngủ nhà - Lê Quang Định, Bình Thạnh - Gần Bà Chiểu - 4 Tầng 70m2 - Chỉ 13.6 t.ỷ còn TL + Diện Tích : 4.2m x 16m ( Nở Hậu 6.56m ) 70m2 + Kết Cấu : 4 Tầng Sân Thượng , 4 Phòng Ngủ ( Có Phòng Dưới Trệt ) , 5 Toilet , Gara Oto , Bếp , Phòng Thờ , Phòng Khách + Vị Trí : Trung Tâm Bình Thạnh , Hẻm Oto 7 Chỗ Vào Nhà , Khu Vực Cực Kỳ An Ninh Dân Trí Sạch sẽ , Gần Bệnh Viện Gia Định , Chợ Bà Chiểu , Chợ Cây Quéo , Trường Học Các Cấp… + SHR Hoàn Công Đủ Nằm Nhà Mời liên hệ ngay em hẹn lịch đi xem nhà trực tiếp","0","0","0","0","0","2,76","45.633","10.8097929","106.6921231","Cache: Street: đường lê quang định, phường gia định, hồ chí minh","3.762874768195117","0.471998025756524","116","0.58249236324604","46","0.387785963195596","15","0.322663721597568","54","2.17554660739305","6","0.0569534253914734","47","2.97455685664012","6"
"https://alonhadat.com.vn/ban-nha-3-tang-ngang-khung-5m-no-hau-tai-loc-pham-the-hien-quan-8-gia-chi-4-9-ty-tl-18921453.html","BÁN NHÀ 3 TẦNG NGANG KHỦNG 5M – NỞ HẬU TÀI LỘC – PHẠM THẾ HIỂN QUẬN 8 – GIÁ CHỈ 4.9 TỶ TL","2026-07-23","đường phạm thế hiển","Đường Phạm Thế Hiển, Phường 7, Quận 8, Hồ Chí Minh (cũ)","phường bình đông","hồ chí minh","18921453","unknown","can_ban","nha_trong_hem","so_hong_so_do","2","4","4.0","5.0","7.5","4900000000.0","37.0","+ Chủ nhà cần vốn kinh doanh nên mong muốn chuyển nhượng căn nhà hẻm an ninh tại đường Phạm Thế Hiển, quận 8, TP. Hồ Chí Minh. + Ưu điểm khu vực dân cư hiện hữu, yên tĩnh. Kết nối cực nhanh sang Quận 5, quận 6 và Bình Chánh… + Trước nhà có sân rộng 3,5m có thể trồng cây kiểng, rau xanh… Không gian sống thoáng đãng, mát mẻ. + Nhà ngang 5m, nở hậu tài lộc 5,2m. Kết cấu chắc chắn 3 tầng, đã hoàn công đủ. + Công năng gồm: phòng khách + phòng bếp + 4PN + 3WC, ban công thoáng mát. Nhà đẹp, ở ngay, không cần sữa chữa. + Thích hợp cho gia đình đông người định cư lâu dài hoặc đầu tư cho thuê giữ tiền. + Liên hệ ngay em Thơ Stella để xem nhà trực tiếp và thương lượng giá tốt.","0","0","0","0","0","8,93","17.419","10.7317497","106.6411046","Cache: Street: đường phạm thế hiển, phường bình đông, hồ chí minh","8.22902867929692","0.367950109928311","91","1.78465844083539","39","0.366433664312371","25","1.59819988101044","9","1.53936819403544","2","0.0263962665257618","25","","0"
"https://alonhadat.com.vn/ban-nha-giap-khu-ten-lua-duong-chien-luoc-4-5x12-2-tang-nhinh-5-ty-18930059.html","Bán Nhà Giáp Khu Tên Lữa - Đường Chiến Lược - 4,5x12 - 2 Tầng - Nhỉnh 5 Tỷ","2026-07-23","đường chiến lược","Đường Chiến Lược, Phường Bình Trị Đông, Quận Bình Tân, Hồ Chí Minh (cũ)","phường bình trị đông","hồ chí minh","18930059","unknown","can_ban","nha_trong_hem","so_hong_so_do","1","3","4.0","4.5","12.0","5370000000.0","49.0","BÁN NHÀ MỚI – CHIẾN LƯỢC, BÌNH TÂN - KẾ BÊN KHU TÊN LỬA - GIÁP Q.6 🏡 DT: 4,5m x 12m Kết Cấu : 1 trệt 1 lầu, 2PN, 3WC, sân thượng. Hẻm 5m, xe hơi tới cửa. 📍 Sát Khu Tên Lửa, giáp Quận 6, Quận 11, Quận 5. Gần AEON Bình Tân, chợ Bà Hom, bệnh viện, trường học. ✅ Nhà mới xây, dọn vào ở ngay. ✅ Bao hoàn công, ra sổ mới khoảng 45 ngày. Sổ hồng chính chủ , Công chứng nhanh.! 💰 Giá chỉ: 5,37 tỷ (thương lượng) Xem nhà và biết thông tin chi tiết liện hệ : Tấn Đạt","1","1","1","0","0","7,15","23.097","10.7615181","106.6109419","Cache: Address: đường chiến lược, phường bình trị đông, quận bình tân, hồ chí minh","9.984901099708178","0.646215636552029","62","0.904370827936585","14","0.290342984552408","15","0.733140258699714","27","2.08402384057875","1","0.130565423283338","44","","0"
"https://alonhadat.com.vn/sieu-vi-tri-cach-rach-xuyen-tam-dang-thuy-tram-1-can-5x20m-15-9-ty-18929933.html","SIÊU VỊ TRÍ CÁCH RẠCH XUYÊN TÂM ĐẶNG THÙY TRÂM 1 CĂN 5X20M 15.9 TỶ","2026-07-23","đường đặng thuỳ trâm","Đường Đặng Thuỳ Trâm, Phường 13, Quận Bình Thạnh, Hồ Chí Minh (cũ)","phường bình lợi trung","hồ chí minh","18929933","unknown","can_ban","nha_trong_hem","so_hong_so_do","1","1","8.0","5.0","20.0","15900000000.0","100.0","Bán nhà đường Đặng Thùy Trâm Bình Thạnh Cách đường Rạch Xuyên Tâm thuộc Đặng Thùy Trâm 1 căn nhà Cách cổng ĐH Văn Lang 65m Đường trước nhà lòng đường rộng 8m có vỉa hè 2 bên đường mỗi bên 3m Toàn bộ khu vực Đặng Thùy Trâm đang dần hoàn thiện: nâng đường, cải tạo kênh, làm đường 2 bên ven kênh tương tự đường Trường Sa Hoàng Sa dọc kênh Nhiêu Lộc Khu vực gần như có hạ tầng ổn định nhất thành phố, quy hoạch vuông vức Gần trường Đại học, thuận tiện di chuyển ra sân bay, về trung tâm Thành Phố Diện tích rất hiếm có vuông vức 5x20m công nhận đủ Quanh khu vực không còn ai bán vì nhu cầu còn cao và tiềm năng tương lai gần rất lớn Phù hợp xây mới Hầm 5 tầng, cách 3 căn đã có nhà xây hầm và đã được hoàn công Pháp lý: đầy đủ, rõ ràng, mua bán ngay Giá bán: 15.9 tỷ Liên hệ xem nhà: Hóa Hutech (Kaoru)","0","0","0","0","0","3,89","29.851","10.8267759","106.7019635","Cache: Address: đường đặng thuỳ trâm, phường 13, quận bình thạnh, hồ chí minh","5.518162999413561","0.322984461461336","52","1.78723452765528","23","0.686384698221988","8","0.744114183575428","26","2.14288950939982","6","0.221641107003845","25","3.70683554254556","4"
"https://alonhadat.com.vn/tim-chu-moi-ban-nha-duong-tran-hung-dao-p2-quan-5-gia-4ty670-76-5m2-shr--18929652.html","Tìm Chủ Mới Bán Nhà Đường Trần Hưng Đạo,P2,Quận 5.Giá 4tỷ670/76,5m2.SHR.","2026-07-23","đường trần hưng đạo","Đường Trần Hưng Đạo, Phường 2, Quận 5, Hồ Chí Minh (cũ)","phường chợ quán","hồ chí minh","18929652","unknown","can_ban","nha_trong_hem","so_hong_so_do","3","4","5.0","5.0","15.0","4670000000.0","76.0","Kẹt Vốn Làm Ăn Cô Chú Chủ Nhà Cần Tìm Chủ Mới Bán Nhà Đường Trần Hưng Đạo,P2,Quận 5.Giá 4tỷ670.Sổ Sẵn. -Diện tích hoàn công đủ 76,5m2 (Ngang 5m Dài 15,3m). Vuông vức -Vị trí thuận tiện kinh doanh gần chợ, bệnh viện, trường học,... cách quận 1 chỉ vải phút di chuyển -Kết cấu :1 Trệt ,3Lầu, Sân Thượng, Phòng Khách, Phòng Bếp, Phòng Thờ, 4PN, 6WC. -Sổ sẵn hoàn công đầy đủ. Hổ trợ ngân hàng 70% Liên hệ tôi để xem nhà .","1","1","1","1","0","1,28","49.645","10.756167","106.6844352","Cache: Address: đường trần hưng đạo, phường 2, quận 5, hồ chí minh","2.9158678573551113","0.181869644938339","173","0.468363776656524","84","0.161375811003761","44","0.578867610379795","89","0.929065544997658","21","0.0126205689583263","62","2.19925940132709","3"
