link,title,post_day,street,old_address,locality,region,listing_id,direction,listing_type,property_type,legal_status,num_floors,num_bedrooms,road_width_m,width_m,length_m,price_vnd,area_m2,dining_room_bin,kitchen_bin,terrace_bin,car_parking_bin,owner_listing_bin,locality_square,locality_population_density,lat,lon,matched_address,distance_to_center_km,nearest_school_km,school_count_3km,nearest_hospital_km,hospital_count_5km,nearest_marketplace_km,marketplace_count_3km,nearest_supermarket_km,supermarket_count_3km,nearest_mall_km,mall_count_3km,nearest_bus_stop_km,bus_stop_count_1km,nearest_metro_km,metro_count_5km
https://alonhadat.com.vn/hang-moi-mat-tien-vo-van-tan-q3-4-tang-gia-45-ty-tl-18769846.html,"Hàng mới mặt tiền Võ Văn Tần , Q3 4 tầng giá 45 tỷ TL",2026-06-10,đường võ văn tần,"Đường Võ Văn Tần, Phường 5, Quận 3, Hồ Chí Minh (cũ)",phường bàn cờ,hồ chí minh,18769846,unknown,can_ban,nha_mat_tien,so_hong_so_do,4,6,30.0,4.6,18.0,45000000000.0,80.0,0,0,0,0,0,"0,99",68.299,10.7727914,106.688564,"Cache: Address: đường võ văn tần, phường 5, quận 3, hồ chí minh",1.4236699663337584,0.1008944875666734,173.0,0.3035788053231241,86.0,0.4773062638854318,46.0,0.3947019809617943,113.0,0.604291039900539,18.0,0.0891303616822696,90.0,1.0394068894087325,5.0
https://alonhadat.com.vn/-hot-hang-hiem-quan-5-115m2-7-tang-thang-may-gia-37-ty-tl-18770131.html,🔥 HOT HÀNG HIẾM QUẬN 5 🔥 115m2 7 tầng thang máy giá 37 tỷ TL,2026-06-10,đường nguyễn chí thanh,"Đường Nguyễn Chí Thanh, Phường 12, Quận 5, Hồ Chí Minh (cũ)",phường chợ lớn,hồ chí minh,18770131,unknown,can_ban,nha_mat_tien,so_hong_so_do,7,15,30.0,4.2,27.0,37000000000.0,115.0,0,0,0,0,0,"1,67",50.938,10.7522989,106.6512192,"Cache: Locality: phường chợ lớn, hồ chí minh",6.077058645332947,0.2294300757931321,185.0,0.9952754727271408,68.0,0.3113409291917248,43.0,0.919397073400981,25.0,0.5028735528918428,5.0,0.0862327276241671,72.0,,0.0
https://alonhadat.com.vn/ban-gap-nha-mt-su-van-hanh-p12-q10-dt-80-5-tang-gia-37-ty-tl-18770196.html,BÁN GẤP NHÀ MT SƯ VẠN HẠNH P12 Q10 DT 80 5 TẦNG GIÁ 37. TỶ TL,2026-06-10,đường sư vạn hạnh,"Đường Sư Vạn Hạnh, Phường 12, Quận 10, Hồ Chí Minh (cũ)",phường hòa hưng,hồ chí minh,18770196,unknown,can_ban,nha_mat_tien,so_hong_so_do,5,10,20.0,4.0,20.0,37000000000.0,80.0,0,0,0,0,0,"2,59",37.225,10.7723361,106.6693289,"Cache: Street: đường sư vạn hạnh, phường hòa hưng, hồ chí minh",3.4896314837271905,0.15306021418663193,221.0,0.13875295088208012,88.0,0.2020532388344237,50.0,0.19899294282364566,79.0,0.19647751691586907,9.0,0.32288360026776924,50.0,3.1267535678307126,3.0
https://alonhadat.com.vn/hot-nhat-q5-mt-nguyen-chi-thanh-4-tang-thang-may-chi-25-ty-18754398.html,HOT NHẤT Q5 MT NGUYỄN CHÍ THANH 4 TẦNG THANG MÁY CHỈ 25 TỶ,2026-06-10,đường nguyễn chí thanh,"Đường Nguyễn Chí Thanh, Phường 9, Quận 5, Hồ Chí Minh (cũ)",phường an đông,hồ chí minh,18754398,unknown,can_ban,nha_mat_tien,so_hong_so_do,4,6,30.0,4.0,15.0,25000000000.0,60.0,0,0,0,0,0,"1,32",61.537,10.7584265,106.6727204,"Cache: Locality: phường an đông, hồ chí minh",3.6979260432430068,0.1718438296278109,193.0,0.0808248175898799,81.0,0.0685624175584255,51.0,0.0700867890565216,70.0,0.0913558508966055,13.0,0.1041175126627032,91.0,3.0810228719302075,3.0
https://alonhadat.com.vn/hang-hot-mt-tran-hung-dap-q5-doan-2-chieu-dt-68m2-5-tang-gia-chi-29-ty-tl-18743562.html,Hàng Hot MT Trần Hưng Đạp Q5 Đoạn 2 Chiểu DT 68m2 5 tầng giá chỉ 29 tỷ TL,2026-06-10,đường trần hưng đạo,"Đường Trần Hưng Đạo, Phường 6, Quận 5, Hồ Chí Minh (cũ)",phường an đông,hồ chí minh,18743562,unknown,can_ban,nha_mat_tien,so_hong_so_do,5,8,30.0,4.0,17.0,29000000000.0,68.0,0,0,0,0,0,"1,32",61.537,10.7584265,106.6727204,"Cache: Locality: phường an đông, hồ chí minh",3.6979260432430068,0.1718438296278109,193.0,0.0808248175898799,81.0,0.0685624175584255,51.0,0.0700867890565216,70.0,0.0913558508966055,13.0,0.1041175126627032,91.0,3.0810228719302075,3.0
https://alonhadat.com.vn/ban-gap-nha-mat-tien-nguyen-tri-phuong-p-8-q10-dt-86m2-ham-6-tang-gia-41-ty-tl-18734497.html,"Bán gấp nhà mặt tiền Nguyễn Tri Phương, P.8, Q10 DT 86m2 hầm  6 tầng giá 41 tỷ TL",2026-06-10,đường nguyễn tri phương,"Đường Nguyễn Tri Phương, Phường 8, Quận 10, Hồ Chí Minh (cũ)",phường diên hồng,hồ chí minh,18734497,unknown,can_ban,nha_mat_tien,so_hong_so_do,7,15,30.0,4.0,21.0,41000000000.0,86.0,0,0,0,0,0,"1,86",40.663,10.7673031,106.6639559,"Cache: Locality: phường diên hồng, hồ chí minh",4.177717404417766,0.1321456498930087,217.0,0.6222421286803709,83.0,0.0770050538488039,55.0,0.1406451216433702,58.0,0.7120967895816094,8.0,0.1383351558074551,65.0,3.732512409760755,3.0
https://alonhadat.com.vn/ban-dat-mat-tien-dang-thuy-tram-p-13-binh-thanh-5m-x-22m-110m-mat-tien-gia-22-ty-18773793.html,"BÁN ĐẤT MẶT TIỀN ĐẶNG THÙY TRÂM, P.13, BÌNH THẠNH – 5m x 22m – 110m² – MẶT TIỀN GIÁ 22 TỶ",2026-06-10,đường đặng thuỳ trâm,"Đường Đặng Thuỳ Trâm, Phường 13, Quận Bình Thạnh, Hồ Chí Minh (cũ)",phường bình lợi trung,hồ chí minh,18773793,unknown,can_ban,nha_mat_tien,unknown,2,2,30.0,5.0,21.0,22000000000.0,110.0,0,0,0,0,0,"3,89",29.851,10.8143593,106.6949846,"Cache: Locality: phường bình lợi trung, hồ chí minh",4.193692198045986,0.2964289749244463,89.0,1.0201470766061114,36.0,0.3530005832131173,14.0,0.2431588066858871,36.0,2.033952162050202,5.0,0.1253517781441358,48.0,3.0225326888196205,6.0
https://alonhadat.com.vn/mat-tien-nguyen-cuu-van-phuong-gia-dinh-khuon-dat-108m2-the-dat-no-hau-gia-chi-266-18766639.html,Mặt tiền Nguyễn Cửu Vân - phường Gia Định - Khuôn đất 108m2 - thế đất nở hậu - giá chỉ 266,2026-06-10,đường nguyễn cửu vân,"Đường Nguyễn Cửu Vân, Phường 17, Quận Bình Thạnh, Hồ Chí Minh (cũ)",phường gia định,hồ chí minh,18766639,unknown,can_ban,nha_mat_tien,so_hong_so_do,2,2,12.0,4.8,23.0,28800000000.0,108.0,0,0,0,0,0,"2,76",45.633,10.7947837,106.7093255,"Cache: Address: đường nguyễn cửu vân, phường 17, quận bình thạnh, hồ chí minh",2.1822596604592133,0.1711869088091718,99.0,1.4231773041651654,47.0,0.3601758043190207,17.0,0.3160654149244814,56.0,2.343508123557825,12.0,0.0265506988051478,43.0,0.6903391017798891,7.0
https://alonhadat.com.vn/ban-nha-mt-truong-son-p-2-q-tb-dt-13m-x-25m-vuong-vuc-tret-1-lau-gia-145-ty-tl-10655186.html,"Bán nhà MT Trường Sơn P.2 Q.TB , DT: 13m x 25m ( vuông vức ) , trệt 1 lầu ,Giá : 88 tỷ TL",2026-06-10,đường trường sơn,"Đường Trường Sơn, Phường 2, Quận Tân Bình, Hồ Chí Minh (cũ)",phường tân sơn hòa,hồ chí minh,10655186,unknown,can_ban,nha_mat_tien,so_hong_so_do,1,6,40.0,13.0,25.0,88000000000.0,325.0,1,1,1,1,0,"2,62",24.485,10.7971454,106.6646052,"Cache: Locality: phường tân sơn hòa, hồ chí minh",4.557522107814423,0.121901450034046,142.0,0.372705061912835,75.0,0.3350057555399626,22.0,0.3298346011531585,36.0,1.3075347650339313,6.0,0.0442449261389241,36.0,4.652140728918879,2.0
https://alonhadat.com.vn/mat-tien-kenh-19-5-gia-chi-90-tr-m2-dt-5-1m-x-50m-265m2-cap-4-gia-chi-19-ty-tl-18462989.html,"Mặt tiền Kênh 19/5 giá chỉ 90 tr/m2 , DT: 5,1m x 50m ( 265m2 ) cấp 4 , Giá chỉ 19 tỷ TL",2026-06-10,đường kênh 19/5,"Đường Kênh 19/5, Phường Sơn Kỳ, Quận Tân Phú, Hồ Chí Minh (cũ)",phường tây thạnh,hồ chí minh,18462989,unknown,can_ban,nha_mat_tien,so_hong_so_do,1,5,16.0,5.1,50.0,19000000000.0,204.0,1,1,1,1,0,"3,95",18.384,10.8130355,106.6227282,"Cache: Locality: phường tây thạnh, hồ chí minh",9.437312222337708,0.11561420024525948,79.0,1.1825672496564021,12.0,0.7911228419865303,7.0,1.042429527974456,16.0,1.4357153886046683,1.0,0.04908664443869594,28.0,,0.0
https://alonhadat.com.vn/toa-nha-dep-goc-2-mat-tien-q-3-dt-13x15m-ham-6-tang-mt-vuon-chuoi-gia-90-ty-18771893.html,"Tòa nhà đẹp ! Góc 2 mặt tiền Q.3 , DT; 13x15m , Hầm 6 tầng , MT Vườn Chuối , Giá 90 tỷ",2026-06-10,đường vườn chuối,"Đường Vườn Chuối, Phường 4, Quận 3, Hồ Chí Minh (cũ)",phường xuân hòa,hồ chí minh,18771893,unknown,can_ban,nha_mat_tien,so_hong_so_do,6,12,16.0,13.0,15.0,90000000000.0,148.0,1,1,1,1,0,"2,22",21.831,10.7824046,106.6895335,"Cache: Locality: phường xuân hòa, hồ chí minh",1.3842360927551391,0.1362858508209465,177.0,0.392725688709276,81.0,0.8309996539468081,44.0,0.306041499917031,114.0,0.4875412983036777,17.0,0.0903504268932904,90.0,1.56192760975934,5.0
https://alonhadat.com.vn/ban-nha-2-mat-tien-311a-vo-van-tan-phuong-5-quan-3-1-tret-3-lau-28-5-ty-hoa-hong-1--18063166.html,"BÁN NHÀ 2 MẶT TIỀN 311A Võ Văn Tần, Phường 5, Quận 3. 1 trệt 3 lầu, 28.5 tỷ, Hoa hồng 1%",2026-06-10,đường võ văn tần,"Đường Võ Văn Tần, Phường 5, Quận 3, Hồ Chí Minh (cũ)",phường bàn cờ,hồ chí minh,18063166,unknown,can_ban,nha_mat_tien,so_hong_so_do,4,6,40.0,4.0,10.0,28500000000.0,50.0,0,0,0,1,0,"0,99",68.299,10.7727914,106.688564,"Cache: Address: đường võ văn tần, phường 5, quận 3, hồ chí minh",1.4236699663337584,0.1008944875666734,173.0,0.3035788053231241,86.0,0.4773062638854318,46.0,0.3947019809617943,113.0,0.604291039900539,18.0,0.0891303616822696,90.0,1.0394068894087325,5.0
https://alonhadat.com.vn/ks-18p-mat-tien-91-suong-nguyet-anh-p-ben-thanh-quan-1-giam-sau-80-ty-xuong-74-ty-tl-18720942.html,"KS 18P- MẶT TIỀN 91 SƯƠNG NGUYỆT ÁNH, P. BẾN THÀNH, QUẬN 1 - GIẢM SÂU 80 TỶ XUỐNG 74 TỶ TL",2026-06-10,đường sương nguyệt ánh,"Đường Sương Nguyệt Ánh, Phường Bến Thành, Quận 1, Hồ Chí Minh (cũ)",phường bến thành,hồ chí minh,18720942,unknown,can_ban,nha_mat_tien,so_hong_so_do,6,18,35.0,7.0,18.0,74000000000.0,80.0,0,0,1,1,0,"1,85",38.809,10.7697658,106.6968854,"Cache: Locality: phường bến thành, hồ chí minh",0.9030639858522528,0.1764317325313514,146.0,0.3786499075275946,88.0,0.3340491056014009,40.0,0.0243052720372051,101.0,0.3829654363777388,19.0,0.0311660268603045,104.0,0.1703670445237422,5.0
https://alonhadat.com.vn/nha-dep-mat-tien-chu-van-an-p-26-binh-thanh-5-tang-4x15m-gia-13-ty-con-bot-18770386.html,Nhà Đẹp Mặt Tiền Chu Văn An P.26 Bình Thạnh - 5 Tầng 4x15m - Giá 13 Tỷ Còn Bớt,2026-06-10,đường chu văn an,"Đường Chu Văn An, Phường 26, Quận Bình Thạnh, Hồ Chí Minh (cũ)",phường bình thạnh,hồ chí minh,18770386,unknown,can_ban,nha_mat_tien,so_hong_so_do,5,5,12.0,4.0,15.0,13000000000.0,60.0,1,1,1,1,0,"3,32",38.042,10.8045369,106.6985299,"Cache: Locality: phường bình thạnh, hồ chí minh",3.067975386545508,0.1536564277820822,117.0,0.3253671289426457,47.0,0.3173412790612379,16.0,0.127429078630904,61.0,3.0678526059733926,0.0,0.1082694455382833,47.0,2.0800873263501067,7.0
https://alonhadat.com.vn/can-ban-gap-nha-mat-tien-duong-vo-van-tan-phuong-6-quan-3-14m-x-30m-ham-5-lau--9470642.html,"Cần bán gấp nhà mặt tiền đường Võ Văn Tần, Phường 6, Quận 3, 14m x 30m, hầm + 5 lầu.",2026-06-10,đường võ văn tần,"Đường Võ Văn Tần, Phường Võ Thị Sáu, Quận 3, Hồ Chí Minh (cũ)",phường xuân hòa,hồ chí minh,9470642,unknown,can_ban,nha_mat_tien,unknown,5,5,30.0,,,245000000000.0,420.0,0,0,0,0,0,"2,22",21.831,10.7824046,106.6895335,"Cache: Locality: phường xuân hòa, hồ chí minh",1.3842360927551391,0.1362858508209465,177.0,0.392725688709276,81.0,0.8309996539468081,44.0,0.306041499917031,114.0,0.4875412983036777,17.0,0.0903504268932904,90.0,1.56192760975934,5.0
https://alonhadat.com.vn/goc-2-mat-tien-nguyen-van-thu-phan-ke-binh-dakao-quan-1-9x18-5m-gia-85-ty-18465763.html,"GÓC 2 MẶT TIỀN NGUYỄN VĂN THỦ - PHAN KẾ BÍNH, ĐAKAO, QUẬN 1 - 9x18.5M - GIÁ 85 TỶ",2026-06-10,đường phan kế bính,"Đường Phan Kế Bính, Phường Sài Gòn, Quận 1, Hồ Chí Minh (cũ)",phường sài gòn,hồ chí minh,18465763,unknown,can_ban,nha_mat_tien,unknown,3,20,20.0,,,85000000000.0,150.0,0,0,0,0,0,"3,04",15.468,10.7803088,106.7054885,"Cache: Locality: phường sài gòn, hồ chí minh",0.6277042037044096,0.4752517013792162,114.0,0.3183914802084917,68.0,0.915369003541698,22.0,0.3312733645976148,97.0,0.690744449731313,15.0,0.0895344751277696,68.0,0.3523202858879943,7.0
https://alonhadat.com.vn/ban-nha-mat-tien-75-truong-dinh-p-ben-thanh-quan-1-cn-113-5m2-cach-cho-ben-thanh-100-18733569.html,"Bán nhà mặt tiền 75 Trương Định, p. Bến Thành, Quận 1 - CN 113,5m2. Cách chợ Bến Thành 100",2026-06-10,đường trương định,"Đường Trương Định, Phường Bến Thành, Quận 1, Hồ Chí Minh (cũ)",phường bến thành,hồ chí minh,18733569,unknown,can_ban,nha_mat_tien,unknown,4,12,30.0,,,75000000000.0,114.0,0,0,0,0,0,"1,85",38.809,10.7697658,106.6968854,"Cache: Locality: phường bến thành, hồ chí minh",0.9030639858522528,0.1764317325313514,146.0,0.3786499075275946,88.0,0.3340491056014009,40.0,0.0243052720372051,101.0,0.3829654363777388,19.0,0.0311660268603045,104.0,0.1703670445237422,5.0
https://alonhadat.com.vn/ban-toa-nha-990f-au-co-p14-tan-binh-12654069.html,Bán toà nhà 990F Âu Cơ P14 Tân Bình,2026-06-10,đường âu cơ,"Đường Âu Cơ, Phường 14, Quận Tân Bình, Hồ Chí Minh (cũ)",phường tân bình,hồ chí minh,12654069,dong_nam,can_ban,nha_mat_tien,so_hong_so_do,10,10,20.0,9.0,33.0,86000000000.0,270.0,0,0,0,0,0,"2,12",42.157,10.8034398,106.6458349,"Cache: Locality: phường tân bình, hồ chí minh",6.699574718241761,0.10954942165432438,110.0,0.601977425693506,37.0,0.5681151544977278,16.0,1.311416453662265,17.0,0.8329555566449584,5.0,0.19649141780049217,23.0,,0.0
https://alonhadat.com.vn/ban-nha-671-duong-pham-the-hien-phuong-4-quan-8-tp-ho-chi-minh--15119594.html,"Bán nhà  Đường Phạm Thế Hiển, Phường 4, Quận 8, TP Hồ Chí Minh.",2026-06-10,đường phạm thế hiển,"Đường Phạm Thế Hiển, Phường 4, Quận 8, Hồ Chí Minh (cũ)",phường chánh hưng,hồ chí minh,15119594,unknown,can_ban,nha_mat_tien,unknown,1,1,20.0,16.0,43.0,75000000000.0,600.0,0,0,0,0,0,"4,61",41.368,10.7460099,106.6829836,"Cache: Locality: phường chánh hưng, hồ chí minh",3.9388908700163734,0.1026391394111249,142.0,0.6244011765486238,76.0,0.389629664161238,41.0,0.0111438965873269,62.0,0.7192455313154356,10.0,0.2217875008797816,29.0,3.203953797566647,3.0
https://alonhadat.com.vn/nha-moi-mat-tien-vo-liem-son-6x18m-p4-quan-8-15453662.html,"Nhà mới mặt tiền Võ Liêm Sơn 6x18m, P4 Quận 8",2026-06-10,đường võ liêm sơn,"Đường Võ Liêm Sơn, Phường 4, Quận 8, Hồ Chí Minh (cũ)",phường chánh hưng,hồ chí minh,15453662,unknown,can_ban,nha_mat_tien,unknown,5,6,25.0,6.0,18.0,18000000000.0,105.0,0,0,0,0,0,"4,61",41.368,10.7460099,106.6829836,"Cache: Locality: phường chánh hưng, hồ chí minh",3.9388908700163734,0.1026391394111249,142.0,0.6244011765486238,76.0,0.389629664161238,41.0,0.0111438965873269,62.0,0.7192455313154356,10.0,0.2217875008797816,29.0,3.203953797566647,3.0
https://alonhadat.com.vn/-ban-nha-84a-duong-cay-diep-nguyen-dinh-chieu-quan-1-17024927.html,"📍 Giảm giá bán gấp Bán nhà 84A Đường Cây Điệp (Nguyễn Đình Chiểu), Quận 1",2026-06-10,đường cây điệp,"Đường Cây Điệp, Phường Đa Kao, Quận 1, Hồ Chí Minh (cũ)",phường tân định,hồ chí minh,17024927,unknown,can_ban,nha_mat_tien,unknown,3,4,10.0,4.0,16.0,25500000000.0,74.0,0,0,0,0,0,"1,23",39.450,10.7911838,106.6923819,"Cache: Locality: phường tân định, hồ chí minh",1.8341731692460652,0.1037729567112353,143.0,0.3167659159924683,74.0,0.2917832726058462,27.0,0.1248165769533943,100.0,1.4754329743928578,13.0,0.1220474644889992,50.0,2.0311407966409747,6.0
https://alonhadat.com.vn/-nha-3-mat-tien-vi-tri-dac-dia-trung-tam-quan-1-84a-cay-diep-nguyen-dinh-chieu--17031060.html,🏡 Nhà 3 Mặt Tiền – Vị Trí Đắc Địa Trung Tâm Quận 1 – 84A Cây Điệp (Nguyễn Đình Chiểu),2026-06-10,đường cây điệp,"Đường Cây Điệp, Phường Đa Kao, Quận 1, Hồ Chí Minh (cũ)",phường tân định,hồ chí minh,17031060,unknown,can_ban,nha_mat_tien,unknown,3,6,8.0,4.0,16.0,25000000000.0,65.0,0,0,0,0,0,"1,23",39.450,10.7911838,106.6923819,"Cache: Locality: phường tân định, hồ chí minh",1.8341731692460652,0.1037729567112353,143.0,0.3167659159924683,74.0,0.2917832726058462,27.0,0.1248165769533943,100.0,1.4754329743928578,13.0,0.1220474644889992,50.0,2.0311407966409747,6.0
https://alonhadat.com.vn/ban-nha-mat-tien-3279-pham-the-hien-p7-quan-8-gia-re--17454458.html,"Bán nhà Mặt tiền 3279 Phạm Thế Hiển, P7, Quận 8( giá rẻ)",2026-06-10,đường phạm thế hiển,"Đường Phạm Thế Hiển, Phường 7, Quận 8, Hồ Chí Minh (cũ)",phường bình đông,hồ chí minh,17454458,unknown,can_ban,nha_mat_tien,unknown,1,1,20.0,10.0,70.0,60000000000.0,1440.0,0,0,0,0,0,"8,93",17.419,10.7317497,106.6411046,"API: Street: đường phạm thế hiển, phường bình đông, hồ chí minh",8.22902867929692,0.36795010992831084,91.0,1.784658440835391,39.0,0.3664336643123712,25.0,1.5981998810104385,9.0,1.5393681940354407,2.0,0.02639626652576185,25.0,,0.0
https://alonhadat.com.vn/-sieu-deal-trung-tam-quan-10-mat-tien-cao-thang-giam-soc-con-45-ty--17506810.html,💥 SIÊU DEAL TRUNG TÂM QUẬN 10 – MẶT TIỀN CAO THẮNG GIẢM SỐC CÒN 45 TỶ 💥,2026-06-10,đường cao thắng,"Đường Cao Thắng, Phường 10, Quận 10, Hồ Chí Minh (cũ)",phường vườn lài,hồ chí minh,17506810,unknown,can_ban,nha_mat_tien,unknown,6,6,30.0,5.2,18.0,45000000000.0,89.0,0,0,0,0,0,"1,28",81.309,10.768525,106.6724938,"Cache: Locality: phường vườn lài, hồ chí minh",3.2419722128438297,0.3010820874778004,222.0,0.2811142836074399,87.0,0.2622385558569263,54.0,0.3931772678968423,92.0,0.3926340325942063,11.0,0.1032738006671135,74.0,2.789766515743807,3.0
https://alonhadat.com.vn/ban-nha-mat-tien-noi-bo-tim-duong-12m-khu-cong-vien-chung-cu-bong-sao-q8-18164198.html,Bán nhà Mặt tiền nội bộ tìm đường 12m khu công viên chung cư Bông Sao Q8,2026-06-10,đường bông sao,"Đường Bông Sao, Phường Bình Đông, Quận 8, Hồ Chí Minh (cũ)",phường bình đông,hồ chí minh,18164198,unknown,can_ban,nha_mat_tien,unknown,4,4,10.0,4.0,16.0,11880000000.0,54.0,0,0,0,0,0,"8,93",17.419,10.7352533,106.6624617,"API: Street: đường bông sao, phường bình đông, hồ chí minh",6.23674807104706,0.21847770366703556,105.0,0.8645982053725461,55.0,0.7382594683885174,22.0,0.8304851119428326,15.0,1.336303960573946,6.0,0.1472638823624618,24.0,,0.0
https://alonhadat.com.vn/-ban-sieu-pham-goc-2-mat-tien-yersin-quan-1-vi-tri-loi-trung-tam-18462592.html,🏢 **BÁN SIÊU PHẨM GÓC 2 MẶT TIỀN YERSIN – QUẬN 1 – VỊ TRÍ LÕI TRUNG TÂM,2026-06-10,đường yersin,"Đường Yersin, Phường Nguyễn Thái Bình, Quận 1, Hồ Chí Minh (cũ)",phường sài gòn,hồ chí minh,18462592,unknown,can_ban,nha_mat_tien,unknown,4,4,30.0,10.6,18.0,165000000000.0,183.0,0,0,0,0,0,"3,04",15.468,10.7803088,106.7054885,"Cache: Locality: phường sài gòn, hồ chí minh",0.6277042037044096,0.4752517013792162,114.0,0.3183914802084917,68.0,0.915369003541698,22.0,0.3312733645976148,97.0,0.690744449731313,15.0,0.0895344751277696,68.0,0.3523202858879943,7.0
https://alonhadat.com.vn/ban-khach-san-mat-tien-cho-lon-quy-mo-45-phong-dong-tien-on-dinh-18462649.html,BÁN KHÁCH SẠN MẶT TIỀN CHỢ LỚN – QUY MÔ 45 PHÒNG – DÒNG TIỀN ỔN ĐỊNH,2026-06-10,đường chợ lớn,"Đường Chợ Lớn, Phường 11, Quận 6, Hồ Chí Minh (cũ)",phường bình phú,hồ chí minh,18462649,unknown,can_ban,nha_mat_tien,unknown,7,45,25.0,12.0,20.0,74000000000.0,240.0,0,0,0,0,0,"2,85",26.640,10.7454169,106.6349712,"Cache: Locality: phường bình phú, hồ chí minh",8.007807626554728,0.2330602650150937,0.0,0.1310703771974542,48.0,0.3671071400546797,35.0,0.5313275732101227,15.0,1.4759221011621504,3.0,0.1355369683452391,37.0,,0.0
https://alonhadat.com.vn/600m2-dat-quan-1-ban-nha-mat-tien-40-42-nguyen-thi-minh-khai-p-da-kao-q-1-15164837.html,"600m2 đất quận 1-Bán nhà mặt tiền 40-42 Nguyễn Thị Minh Khai, P. Đa Kao, Q.1",2026-06-10,đường nguyễn thị minh khai,"Đường Nguyễn Thị Minh Khai, Phường Đa Kao, Quận 1, Hồ Chí Minh (cũ)",phường tân định,hồ chí minh,15164837,dong_nam,can_ban,nha_mat_tien,so_hong_so_do,2,2,30.0,17.0,38.0,400000000000.0,600.0,0,0,0,0,0,"1,23",39.450,10.7911838,106.6923819,"Cache: Locality: phường tân định, hồ chí minh",1.8341731692460652,0.1037729567112353,143.0,0.3167659159924683,74.0,0.2917832726058462,27.0,0.1248165769533943,100.0,1.4754329743928578,13.0,0.1220474644889992,50.0,2.0311407966409747,6.0
https://alonhadat.com.vn/ban-toa-nha-can-ho-dich-vu-binh-thoi-p11-quan-11-dt-349m2-ham-6-tang-hdt-230tr-chi-50-ty-14142258.html,"Bán toà nhà căn hộ dịch vụ Bình Thới, P11, Quận 11,DT:349m2 Hầm 6 tầng HĐT:230tr chỉ 50 tỷ",2026-06-10,đường bình thới,"Đường Bình Thới, Phường 11, Quận 11, Hồ Chí Minh (cũ)",phường phú thọ,hồ chí minh,14142258,unknown,can_ban,nha_mat_tien,unknown,6,6,30.0,10.0,30.0,50000000000.0,350.0,0,0,0,0,0,"1,37",47.715,10.7625111,106.6499732,"API: Address: đường bình thới, phường 11, quận 11, hồ chí minh",5.79287805193748,0.06860859206985537,205.0,0.30262028423172466,76.0,0.3731817743902513,51.0,0.9790152972483656,31.0,1.0863382389252907,5.0,0.08437928188478291,72.0,,0.0
https://alonhadat.com.vn/ban-nha-mat-tien-205-tran-binh-trong-quan-5-18135975.html,BÁN NHÀ MẶT TIỀN 205 TRẦN BÌNH TRỌNG  QUẬN 5,2026-06-10,đường trần bình trọng,"Đường Trần Bình Trọng, Phường 3, Quận 5, Hồ Chí Minh (cũ)",phường chợ quán,hồ chí minh,18135975,unknown,can_ban,nha_mat_tien,unknown,5,5,30.0,5.8,20.0,52000000000.0,105.0,0,0,0,0,0,"1,28",49.645,10.7546957,106.6849182,"Cache: Locality: phường chợ quán, hồ chí minh",3.014593454140083,0.3241044718172312,169.0,0.3112080841955486,82.0,0.159361009708267,44.0,0.7452963371051138,87.0,1.0997159326303276,20.0,0.1351310290030301,57.0,2.2897201696442395,3.0
https://alonhadat.com.vn/-nha-goc-mt-truong-chinh-p14-tan-binh-no-hau-dep-hdt-120tr-thang-gia-50-ty-18411903.html,🏢 NHÀ GÓC MT TRƯỜNG CHINH – P14 TÂN BÌNH – NỞ HẬU ĐẸP – HĐT 120TR/THÁNG – GIÁ 50  Tỷ,2026-06-10,đường trường chinh,"Đường Trường Chinh, Phường 14, Quận Tân Bình, Hồ Chí Minh (cũ)",phường tân bình,hồ chí minh,18411903,tay_bac,can_ban,nha_mat_tien,so_hong_so_do,1,1,20.0,5.5,28.0,50000000000.0,198.0,0,0,0,0,0,"2,12",42.157,10.8034398,106.6458349,"Cache: Locality: phường tân bình, hồ chí minh",6.699574718241761,0.10954942165432438,110.0,0.601977425693506,37.0,0.5681151544977278,16.0,1.311416453662265,17.0,0.8329555566449584,5.0,0.19649141780049217,23.0,,0.0
https://alonhadat.com.vn/ban-toa-nha-8-tang-goc-2-mat-tien-noi-bo-khu-283-cmt8-quan-10-sieu-dep-78-ty-18411951.html,Bán Toà nhà 8 tầng góc 2 mặt tiền nội bộ khu 283 CMT8 Quận 10 siêu đẹp 78 tỷ,2026-06-10,đường cách mạng tháng 8,"Đường Cách Mạng Tháng 8, Phường Diên Hồng, Quận 10, Hồ Chí Minh (cũ)",phường diên hồng,hồ chí minh,18411951,unknown,can_ban,nha_mat_tien,unknown,7,8,12.0,16.0,9.0,78000000000.0,128.0,0,0,0,0,0,"1,86",40.663,10.7673031,106.6639559,"Cache: Locality: phường diên hồng, hồ chí minh",4.177717404417766,0.1321456498930087,217.0,0.6222421286803709,83.0,0.0770050538488039,55.0,0.1406451216433702,58.0,0.7120967895816094,8.0,0.1383351558074551,65.0,3.732512409760755,3.0
https://alonhadat.com.vn/ban-nha-mat-tien-335-337-339-vo-van-tan-p-5-quan-3-18408490.html,"Bán nhà mặt tiền 5 tầng📍335 – 337 – 339 Võ Văn Tần, P.5, Quận 3",2026-06-10,đường võ văn tần,"Đường Võ Văn Tần, Phường 5, Quận 3, Hồ Chí Minh (cũ)",phường bàn cờ,hồ chí minh,18408490,dong_nam,can_ban,nha_mat_tien,so_hong_so_do,5,5,30.0,9.0,15.0,86000000000.0,150.0,0,0,0,0,0,"0,99",68.299,10.7727914,106.688564,"Cache: Address: đường võ văn tần, phường 5, quận 3, hồ chí minh",1.4236699663337584,0.1008944875666734,173.0,0.3035788053231241,86.0,0.4773062638854318,46.0,0.3947019809617943,113.0,0.604291039900539,18.0,0.0891303616822696,90.0,1.0394068894087325,5.0
https://alonhadat.com.vn/nha-4-tang-mat-tien-kdc-bong-sao-p5-q8-18380358.html,"Nhà 4 tầng, mặt tiền KDC Bông Sao P5 Q8",2026-06-10,đường bông sao,"Đường Bông Sao, Phường 5, Quận 8, Hồ Chí Minh (cũ)",phường bình đông,hồ chí minh,18380358,unknown,can_ban,nha_mat_tien,unknown,2,4,10.0,4.0,12.0,9900000000.0,48.0,0,0,0,0,0,"8,93",17.419,10.7352533,106.6624617,"Cache: Street: đường bông sao, phường bình đông, hồ chí minh",6.23674807104706,0.21847770366703556,105.0,0.8645982053725461,55.0,0.7382594683885174,22.0,0.8304851119428326,15.0,1.336303960573946,6.0,0.1472638823624618,24.0,,0.0
